date,title,source,link,summary,sentiment_label,sentiment_score
2025-10-06,Ahead of Market: 10 things that will decide stock market action on Tuesday,NewsAPI - The Times of India,https://economictimes.indiatimes.com/markets/stocks/news/ahead-of-market-10-things-that-will-decide-stock-market-action-on-tuesday/articleshow/124343593.cms,"Indian markets rose for the third session, led by strong gains in banking, financials, and IT ahead of Q2 earnings. Nifty reclaimed the 25,000 mark, supported by upbeat loan growth data and improving technical momentum suggesting a potential rally toward 25,5…",positive,0.950284
2025-10-06,"FPIs Remain Net Sellers Even As Nifty Closes Above 25,000",NewsAPI - Ndtvprofit.com,https://www.ndtvprofit.com/markets/fpis-remain-net-sellers-even-as-nifty-closes-above-25000,"The foreign portfolio investors on Monday stayed net sellers of Indian shares for the 10th consecutive session. The FPIs sold stocks worth approximately Rs 313.77 crore, according to provisional data from the National Stock Exchange. The DIIs stayed net buyer…",neutral,0.779604
2025-10-06,"Sensex, Nifty extend rally for 3rd session; IT, banking & financial stocks fuel momentum",NewsAPI - BusinessLine,https://www.thehindubusinessline.com/markets/stock-markets/top-gainers-losers-today-6th-oct-2025-sensex-nifty-extend-rally-for-3rd-session-it-banking-financial-stocks-fuel-momentum/article70131041.ece,"Max Healthcare, Shriram Finance, TCS, Tech Mahindra, Apollo Hospitals, Axis Bank and Kotak lead gainers, while Trent, Tata Steel, Adani Ports, Power Grid and Eicher Motors emerged as major laggards.",positive,0.727951
2025-10-06,"Rupee boxed in by persistent importer hedging, central bank intervention",NewsAPI - The Times of India,https://economictimes.indiatimes.com/markets/forex/forex-news/india-rupee-rupee-boxed-in-by-persistent-importer-hedging-central-bank-intervention/articleshow/124337698.cms,"The Indian rupee held steady near its record low, bolstered by likely RBI intervention amidst persistent dollar demand from importers. While upcoming IPOs might offer some relief through foreign inflows, analysts caution about potential further rupee deprecia…",negative,0.493881
2025-10-06,"BSE and TCS among top stock picks; Nifty to retest 25,400, says Angel One’s Rajesh Bhosale",NewsAPI - The Times of India,https://economictimes.indiatimes.com/markets/expert-view/bse-and-tcs-among-top-stock-picks-nifty-to-retest-25400-says-angel-ones-rajesh-bhosale/articleshow/124337298.cms,"Rajesh Bhosale of Angel One anticipates the Nifty 50 will consolidate around 25,000 before resuming its upward momentum towards 25,400, advising investors to buy on dips. He notes strong performance in Bank Nifty and Fin Nifty, signaling broader market streng…",positive,0.93711
2025-10-06,"Market Wrap: Sensex rallies 580 points, Nifty tops 25,000 as banks surge on solid loan growth",NewsAPI - The Times of India,https://economictimes.indiatimes.com/markets/stocks/news/market-wrap-sensex-rallies-580-points-nifty-tops-25000-as-banks-surge-on-solid-loan-growth/articleshow/124337192.cms,"Indian equity benchmarks Sensex and Nifty closed higher on Monday, driven by banking and financial heavyweights after lenders posted strong quarterly loan growth, while IT stocks gained ground ahead of the upcoming earnings releases.",positive,0.943162
2025-10-06,Gold and Bitcoin go through the roof as U.S. shutdown forces investors to trade in the dark,NewsAPI - Yahoo Entertainment,https://finance.yahoo.com/news/gold-bitcoin-roof-u-shutdown-095445924.html,"There is a 67% chance that the U.S. federal government shutdown will last longer than 10 days, according to bettors on Polymarket—and for stock traders that ...",neutral,0.536787
2025-10-06,Gold and Bitcoin go through the roof as U.S. shutdown forces investors to trade in the dark,NewsAPI - Fortune,https://fortune.com/2025/10/06/gold-price-bitcoin-u-s-shutdown-stocks/,"There is a 67% chance that the U.S. federal government shutdown will last longer than 10 days, according to bettors on Polymarket—and for stock traders that will feel like an eternity.",negative,0.547825
2025-10-06,"FMCG Q2 Results Calendar: When Will HUL, Nestle India, Dabur India Announce Quarterly Earnings?",NewsAPI - Ndtvprofit.com,https://www.ndtvprofit.com/quarterly-earnings/fmcg-q2-results-calendar-when-will-hul-nestle-india-dabur-india-announce-quarterly-earnings,"Leading FMCG companies such as Hindustan Unilever Ltd., Nestle India Ltd. and Dabur India Ltd., are set to release their Q2 FY26 earnings during the course of this month. The reports will provide a detailed overview of their financial performance for the July…",neutral,0.943136
2025-10-06,"Upwork CEO Hayden Brown: ‘There will be plenty of work for humans, even as AI agents do more’",NewsAPI - Fortune,https://fortune.com/2025/10/06/upwork-ceo-hayden-brown-there-will-be-plenty-of-work-for-humans-even-as-ai-agents-do-more/,Also: All the news and watercooler chat from Fortune.,neutral,0.86515
2025-10-06,Mid-market: Sensex rallies over 600 pts led by banking & IT stocks,NewsAPI - BusinessLine,https://www.thehindubusinessline.com/markets/stock-markets/top-movers-in-indian-stock-market-today-6th-oct-sensex-rallies-over-600-pts-led-by-banking-it-stocks/article70130531.ece,"Nifty, Sensex near day’s high. Banking and financial heavyweights post robust quarterly results. Kotak, Axis Bank & HDFC Bank lead gainers.",positive,0.931525
2025-10-06,Farther Finance Advisors LLC Buys 350 Shares of iShares India 50 ETF $INDY,NewsAPI - ETF Daily News,https://www.etfdailynews.com/2025/10/06/farther-finance-advisors-llc-buys-350-shares-of-ishares-india-50-etf-indy/,"Farther Finance Advisors LLC increased its stake in iShares India 50 ETF (NASDAQ:INDY – Free Report) by 36.2% in the second quarter, Holdings Channel.com reports. The institutional investor owned 1,316 shares of the company’s stock after acquiring an addition…",positive,0.915374
2025-10-06,Q2 earnings beginning this week to be modest but 3 themes can make money: Motilal Oswal,NewsAPI - The Times of India,https://economictimes.indiatimes.com/markets/stocks/news/q2-earnings-beginning-this-week-to-be-modest-but-3-themes-can-make-money-motilal-oswal/articleshow/124331652.cms,"Q2 earnings, starting October 9, are expected to show modest 6% YoY growth for Nifty companies. Motilal Oswal highlights three investment themes—financials vs IT divergence, consumption revival, and new-age sectors—and recommends top large- and mid-cap stocks…",neutral,0.819853
2025-10-06,"Nifty prediction today – October 6, 2025: Nifty 50 futures: Bullish. Go long on dips",NewsAPI - BusinessLine,https://www.thehindubusinessline.com/portfolio/technical-analysis/nifty-prediction-today-october-6-2025-nifty-50-futures-bullish-go-long-on-dips/article70130169.ece,"Nifty 50 outlook is bullish with potential rise to 25,030, but watch for declines below 25,000 support level.",negative,0.865881
2025-10-06,"Nifty, Sensex open flat on Monday, 13 months of no returns, weak earnings for Q2, FY26 to keep sentiments subdued",NewsAPI - BusinessLine,https://www.thehindubusinessline.com/markets/nifty-sensex-open-flat-on-monday-13-months-of-no-returns-weak-earnings-for-q2-fy26-to-keep-sentiments-subdued/article70130101.ece,"Despite global optimism and selective sectoral strength, domestic markets continue to remain cautious ahead of the earnings season, FII activity trends, and global policy developments",negative,0.951589
2025-10-06,History Favors Bulls: Nifty Has An 80% Win Rate When Diwali Falls In October,NewsAPI - Ndtvprofit.com,https://www.ndtvprofit.com/markets/history-favors-bulls-nifty-has-an-80-win-rate-when-diwali-falls-in-october,"On Friday, the benchmark Nifty 50 opened lower but swiftly recovered from initial losses, trading within the first-hour range for most of the session. In the latter half, however, the bulls gained momentum, pushing the index past the 24,900 mark. By the close…",negative,0.499626
2025-10-06,"Trading Plan: Can Nifty 50 target third session of gains, Bank Nifty reclaim 55,800?",NewsAPI - Moneycontrol,https://www.moneycontrol.com/news/business/markets/trading-plan-can-nifty-50-target-third-session-of-gains-bank-nifty-reclaim-55-800-13598021.html,"For further upward movement, the Nifty 50 needs to reclaim and sustain above 25,000 for a potential move toward 25,100–25,200. However, until then, consolidation may be seen, with immediate support at 24,750, followed by 24,600 as crucial support.",positive,0.892144
2025-10-06,"BL Morning report: October 6, 2025",NewsAPI - BusinessLine,https://www.thehindubusinessline.com/multimedia/audio/bl-morning-report-october-6-2025/article70128486.ece,"India's crude oil imports, stock market updates, cough syrup deaths, and India-EU trade talks in a nutshell.",neutral,0.83229
2025-10-06,"Which investment asset class gave best returns in 10 years? Gold, equity, real estate or debt? Here’s a performance tracker",NewsAPI - The Times of India,https://economictimes.indiatimes.com/wealth/invest/which-investment-asset-class-gave-best-returns-in-10-years-gold-equity-real-estate-or-debt-heres-a-performance-tracker/articleshow/124302799.cms,"Gold and silver are dominating in 2025 due to global uncertainty and strong demand, while mid- and small-cap equities underperformed. However, mid-cap equities are projected to lead long-term performance charts, driven by efficiency and adaptability. Gold rem…",positive,0.609147
2025-10-06,All You Need To Know Going Into Trade On Monday,NewsAPI - Ndtvprofit.com,https://www.ndtvprofit.com/markets/stock-market-today-all-you-need-to-know-going-into-trade-on-oct-6-3,"The Indian benchmarks extended their gains into the second day this week and closed higher. The Nifty 50 closed 0.23% higher at 24,894.25 while Sensex closed 0.26% higher at 81191.58. All sectoral indices gain higher for the week.",positive,0.922066
2025-10-06,"NSE trims lot sizes for Nifty, Bank Nifty",NewsAPI - The Times of India,https://economictimes.indiatimes.com/markets/stocks/news/nse-trims-lot-sizes-for-nifty-bank-nifty/articleshow/124328090.cms,"The National Stock Exchange has reduced the market lot sizes for derivative contracts across four key indices, including Nifty and Nifty Bank, effective from year-end. This move aims to make trading cheaper for participants by lowering contract values and mar…",negative,0.893272
2025-10-06,WA taxpayers fork out millions to Griffin Coal's Indian backer,NewsAPI - ABC News (AU),https://www.abc.net.au/news/2025-10-06/taxpayer-dollars-leak-offshore-amid-griffin-coal-failure/105846232,"The WA government is facing fresh questions over its bailout of an embattled coal mine that is critical to the state's energy system, amid revelations taxpayer money is leaking offshore.",negative,0.96052
2025-10-06,Planned provisioning norms unlikely to hit private banks hard,NewsAPI - The Times of India,https://economictimes.indiatimes.com/industry/banking/finance/banking/planned-provisioning-norms-unlikely-to-hit-private-banks-hard/articleshow/124325391.cms,"ECL is a forward-looking accounting standard that requires banks to make provisions on expected losses based on past asset quality, instead of incurred loss-based provisioning. The already created buffer would come into play from the first quarter of FY28. ""B…",neutral,0.905291
2025-10-06,Planned provisioning norms unlikely to hit private banks hard,NewsAPI - The Times of India,https://economictimes.indiatimes.com/industry/banking/finance/banking/planned-provisioning-norms-unlikely-to-hit-private-banks-hard/articleshow/124328154.cms,"ECL is a forward-looking accounting standard that requires banks to make provisions on expected losses based on past asset quality, instead of incurred loss-based provisioning. The already created buffer would come into play from the first quarter of FY28. ""B…",neutral,0.905291
2025-10-06,"India's IT sector: No festive spark in Q2, macro headwinds weigh heavily on growth",NewsAPI - The Times of India,https://timesofindia.indiatimes.com/business/india-business/indias-it-sector-no-festive-spark-in-q2-macro-headwinds-weigh-heavily-on-growth/articleshow/124326639.cms,"India's IT services sector anticipates modest Q2 2025 results due to macroeconomic uncertainty and client caution. While Tier-I firms like Infosys and HCLTech show slight growth, mid-tier companies are set to outperform. Margins remain steady, but GenAI's def…",positive,0.617759
2025-10-06,Wall Street’s Hottest Clean-Energy Bet Hits a Ceiling,NewsAPI - Yahoo Entertainment,https://finance.yahoo.com/news/wall-street-hottest-clean-energy-230000121.html,"Wood Mackenzie projects community solar to shrink 12% annually through 2030, with only limited upside from favorable state policies.",negative,0.947514
2025-10-06,H-1B Visa Filings Under Scrutiny: What Led Senators To Investigate TCS And Big Tech,NewsAPI - Freerepublic.com,https://freerepublic.com/focus/f-chat/4344526/posts,"US senators Charles Grassley and Richard Durbin have raised concerns about major corporations, including Tata Consultancy Services (TCS) and Cognizant, for filing thousands of H-1B skilled worker visa petitions even as they conducted large-scale layoffs of Am…",negative,0.954927
2025-10-06,Wall Street’s Hottest Clean-Energy Bet Hits a Ceiling,NewsAPI - OilPrice.com,https://oilprice.com/Alternative-Energy/Solar-Energy/Wall-Streets-Hottest-Clean-Energy-Bet-Hits-a-Ceiling.html,"A couple of years ago, a cross-section of Wall Street was highly bullish on the community solar sector, with some predicting that it was poised to become the most prevalent model of residential solar power distribution in the United States. First unveiled abo…",positive,0.497315
2025-10-06,"Harbor Freight Parking Lot Sale: Bauer Power Tools 25% Off, US General Cabinets 20% Off & More (In-Stores Only/ITC Member Access 10/6-10/9)",NewsAPI - Slickdeals.net,https://slickdeals.net/f/18625690-harbor-freight-parking-lot-sale-bauer-power-tools-25-off-us-general-cabinets-20-off-more-in-stores-only-itc-member-access-10-6-10-9,"No super great deals with the tariffs on everything, but a couple of good deals 
 
Inside Track Club starts Oct 6th, regular people starts on Friday Oct 10th 
 
If you were ever thinking of joining...",neutral,0.917962
2025-10-06,"ET Market Watch: Bullish start to the week, financials & IT lead Sensex, Nifty rally",NewsAPI - The Times of India,https://economictimes.indiatimes.com/markets/stocks/etmarkets-podcast/et-market-watch-bullish-start-to-the-week-financials-it-lead-sensex-nifty-rally/podcast/124340255.cms,"Indian markets kicked off the week on a strong note, led by banking and IT heavyweights. The Sensex jumped 583 points to close at 81,790, while the Nifty gained 183 points to reclaim the 25,000 mark.",positive,0.941209
2025-10-06,"Q2 Results Preview: OMCs To Drive The Modest Earnings Growth; L&T, M&M, Swiggy Among Motilal Oswal's Top Ideas",NewsAPI - Ndtvprofit.com,https://www.ndtvprofit.com/research-reports/q2-results-preview-omcs-to-drive-the-modest-earnings-growth-lt-mm-swiggy-among-motilal-oswals-top-ideas,"Top ideas: 

Largecaps: Bharti Airtel, ICICI Bank, Larsen & Toubro, Mahindra & Mahindra, Ultratech Cement, Titan Company, Max Healthcare, Bharat Electronics, Tech Mahindra, TVS Motors, Macrotech, and Indian Hotels. 

Midcaps and Smallcaps – Dixon Technologies…",neutral,0.862559
2025-10-06,"JSW One Platforms raises ₹575 crore from SBI, others",NewsAPI - BusinessLine,https://www.thehindubusinessline.com/money-and-banking/jsw-one-platforms-raises-575-crore-from-sbi-others/article70130548.ece,"The round, initiated in May, witnessed participation from marquee investors including the State Bank of India, Principal Asset Management, One-Up, International Conveyors, Scarlett Ventures and JSW Steel",positive,0.783785
2025-10-06,"Sensex jumps over 100 pts, Nifty tops 24,900 as IT, bank stocks rise",NewsAPI - The Times of India,https://economictimes.indiatimes.com/markets/stocks/news/sensex-jumps-over-100-pts-nifty-tops-24900-as-banks-it-rise/articleshow/124329862.cms,"Indian equity benchmarks Sensex and Nifty opened higher on Monday, propelled by advances in banking and IT stocks. Investor sentiment received a boost from recent central bank lending reforms, as traders also positioned themselves ahead of the busy quarterly …",positive,0.94884
2025-10-06,Bhavik Enterprises IPO: Shares flat in grey market ahead of debut,NewsAPI - The Times of India,https://economictimes.indiatimes.com/markets/ipos/fpos/bhavik-enterprises-ipo-shares-flat-in-grey-market-ahead-of-debut/articleshow/124328760.cms,Bhavik Enterprises will debut on the BSE SME platform on October 6. It raised Rs 77 crore through its IPO. The issue received a subdued response and showed no grey market premium. The stock may list near its Rs 140 issue price. Bhavik Enterprises trades polym…,negative,0.717811
2025-10-06,MPK Steels IPO set for listing on Monday. Check GMP ahead of debut,NewsAPI - The Times of India,https://economictimes.indiatimes.com/markets/stocks/news/mpk-steels-ipo-set-for-listing-on-monday-check-gmp-ahead-of-debut/articleshow/124328695.cms,"MPK Steels debuts on the BSE SME platform on October 6 after its Rs 25.74 crore IPO received a tepid 1.54 times subscription. QIBs drove demand, but retail and HNI interest was subdued. With a zero grey market premium, muted listing expectations are set near …",negative,0.69012
2025-10-06,Sunil Mittal’s Bharti Telecom mulls record $1.7 billion bond deal,NewsAPI - The Times of India,https://economictimes.indiatimes.com/markets/bonds/sunil-mittals-bharti-telecom-mulls-record-1-7-billion-bond-deal/articleshow/124336223.cms,"Indian billionaire Sunil Mittal’s Bharti Telecom is reportedly considering a substantial 150 billion rupee ($1.7 billion) bond offering as early as next week. The proceeds are primarily earmarked for refinancing upcoming debt maturities, including 97.5 billio…",neutral,0.842636
2025-10-06,Pre-market action: Here's the trade setup for today's session,NewsAPI - The Times of India,https://economictimes.indiatimes.com/markets/stocks/news/pre-market-action-heres-the-trade-setup-for-todays-session/articleshow/124322856.cms,"Indian equities closed higher for a second consecutive session on Friday, buoyed by the RBI's dovish stance and recent regulatory reforms. Analysts expect sustained positive momentum, supported by accommodative monetary policy and a favorable monsoon. India V…",positive,0.948237
2025-10-06,Fino Payments Bank settles disclosure lapses case with Sebi; pays Rs 5.88 lakh,NewsAPI - The Times of India,https://economictimes.indiatimes.com/markets/stocks/news/fino-payments-bank-settles-disclosure-lapses-case-with-sebi-pays-rs-5-88-lakh/articleshow/124340614.cms,Fino Payments Bank on Monday settled a case pertaining to failure to make timely and complete disclosure regarding frauds perpetrated by its employees with markets regulator Sebi after paying Rs 5.88 lakh.,negative,0.947046
2025-10-06,Saudi Arabia's PIF plans dual-tranche green bond sale -IFR,NewsAPI - The Times of India,https://economictimes.indiatimes.com/markets/bonds/saudi-arabias-pif-plans-dual-tranche-green-bond-sale-ifr/articleshow/124334828.cms,"Saudi Arabia's Public Investment Fund plans to issue a two-part euro-denominated green bond, fixed-income news service IFR reported on Monday.",neutral,0.807996
2025-10-06,"Adani Enterprises taps debt private placement after 2-year gap, bankers say",NewsAPI - The Times of India,https://economictimes.indiatimes.com/markets/bonds/adani-enterprises-taps-debt-private-placement-after-2-year-gap-bankers-say/articleshow/124340695.cms,"Indian billionaire Gautam Adani's flagship firm is slated to raise up to 10 billion rupees ($112.6 million) through the private placement of two-year and six-month bonds, two bankers said on Monday, marking its first such fundraising since 2023.",positive,0.776998
2025-10-06,DMart shares slip over 1% even after strongest Q2 revenue in 4 years,NewsAPI - The Times of India,https://economictimes.indiatimes.com/markets/stocks/news/dmart-shares-in-focus-after-posting-strongest-q2-revenue-in-4-years/articleshow/124329894.cms,"DMart shares: In its Q2 FY26 business update, the retailer reported standalone revenue of Rs 16,218.79 crore, up from Rs 14,050.32 crore a year earlier. The figures are subject to a limited review by the company’s statutory auditors.",positive,0.670213
2025-10-06,"5 credit cards for best cashback, rewards and discounts in festive season",NewsAPI - The Times of India,https://economictimes.indiatimes.com/wealth/spend/5-credit-cards-for-best-cashback-rewards-and-discounts-in-festive-season/articleshow/124303164.cms,Diwali shopping continues with new discounts expected. Credit cards offer significant savings during festive sales. Different cards cater to various spending habits. SimplyCLICK SBI suits sale shoppers. CASHBACK SBI provides broad online savings. Co-branded c…,neutral,0.663518
2025-10-06,Is Tata Capital IPO a long-term bet or wait-and-watch opportunity?,NewsAPI - The Times of India,https://economictimes.indiatimes.com/markets/ipos/fpos/is-tata-capital-ipo-a-long-term-bet-or-wait-and-watch-opportunity/articleshow/124328192.cms,"Tata Capital's upcoming IPO is priced at a discount, reflecting its lower net interest margin and return ratios compared to peers. While its loan book grew significantly, a merger with Tata Motors Finance increased its gross NPAs. Investors are advised to obs…",negative,0.783096
2025-10-06,"Sunil Mittal’s Bharti Telecom mulls record ₹15,000 crore bond deal",NewsAPI - Bloomberg,https://www.bloomberg.com/news/articles/2025-10-06/billionaire-s-bharti-telecom-mulls-record-1-7-billion-bond-deal,"Billionaire Sunil Mittal’s Bharti Telecom Ltd is considering to offer about ₹15,000 crore ($1.7 billion) of bonds as early as next week, according to people familiar with the matter.",neutral,0.888704
2025-10-06,"Hero Future Energies secures ₹1,908 crore from SBI, Canara Bank for 120 MW hybrid project",NewsAPI - BusinessLine,https://www.thehindubusinessline.com/news/national/hero-future-energies-secures-1908-crore-from-sbi-canara-bank-for-120-mw-hybrid-project/article70131146.ece,"The project, executed through SPV Clean Renewable Energy Hybrid Three Private Limited, is contracted with SJVN and combines wind, solar, and storage technologies to provide reliable peak power.",positive,0.693135
2025-10-06,"Stocks in news: HDFC Bank, DMart, Vedanta, Tata Steel, Bajaj Finance, Vodafone Idea",NewsAPI - The Times of India,https://economictimes.indiatimes.com/markets/stocks/news/stocks-in-news-hdfc-bank-dmart-vedanta-tata-steel-bajaj-finance-vodafone-idea/articleshow/124322778.cms,"Markets closed higher on Friday, with Nifty testing key resistance at 24,900. Analysts predict further recovery if this level is breached. Several companies are in focus today. HDFC Bank reported loan growth. DMart and Bajaj Housing Finance showed strong reve…",positive,0.949965
2025-10-06,Corporate Sapphiro Forex Card: ICICI Bank and Visa launch premium card for business travellers,NewsAPI - Economictimes.com,https://m.economictimes.com/wealth/spend/corporate-sapphiro-forex-card-icici-bank-and-visa-launch-premium-card-for-business-travellers/premium-corporate-sapphiro-forex-card/slideshow/124338536.cms,"ICICI Bank, in partnership with Visa, has launched the Corporate Sapphiro Forex Card, exclusively designed for entrepreneurs and corporate leaders travelling abroad. Premium Corporate Sapphiro Forex Card",positive,0.527697
2025-10-06,Hero Future Energies secures funding for 120 MW RE hybrid project,NewsAPI - BusinessLine,https://www.thehindubusinessline.com/companies/hero-future-energies-secures-funding-for-120-mw-re-hybrid-project/article70131589.ece,Hero Future Energies secures Rs 190.80 crore funding from SBI and Canara Bank for renewable energy project in Kurnool.,positive,0.879865
2025-10-06,マウンテンバイクイベント「RAINBOW CUP 2025」初の新潟・妙高で開催！子どもから大人まで楽しめる大会、参加者募集中,NewsAPI - Prtimes.jp,https://prtimes.jp/main/html/rd/p/000000008.000138657.html,"[ 株式会社Asia Union TCS]
[画像1: https://prcdn.freetls.fastly.net/release_image/138657/8/138657-8-a93add507fd8f02c3f20347f991cac0d-1623x1623.jpg?width=536&quality=85%2C75&format=jpeg&auto=webp&fit=bounds&am...",neutral,0.917414
2025-10-06,Airtel Business bags multi-year contract for Indian Railway security operations centre,NewsAPI - BusinessLine,https://www.thehindubusinessline.com/info-tech/airtel-business-bags-multi-year-contract-for-indian-railway-security-operations-centre/article70130454.ece,"Airtel will design, build, implement and operate a greenfield, multi-layered cybersecurity protection ecosystem that will serve as a defence barrier to safeguard the Indian Railways’ IT backbone",positive,0.587167
2025-10-06,Jefferies plans entry into India’s fast-growing mutual fund market,NewsAPI - Bloomberg,https://www.bloomberg.com/news/articles/2025-10-06/jefferies-enlists-barve-for-india-mutual-fund-foray-as-global-giants-pile-in,"Jefferies signs up Milind Barve, former head of HDFC Asset Management Co, as adviser to shape its strategy and steer regulatory approvals",neutral,0.771993
2025-10-06,Battle of NBFC giants: Should you invest in Tata Capital IPO or one of Bajaj Finance and HDB Financial?,NewsAPI - The Times of India,https://economictimes.indiatimes.com/markets/stocks/news/battle-of-nbfc-giants-should-you-invest-in-tata-capital-ipo-or-one-of-bajaj-finance-and-hdb-financial/articleshow/124331557.cms,"Tata Capital’s IPO positions it between Bajaj Finance and HDB Financial, offering investors a tactical growth opportunity with potential re-rating backed by its strong brand, capital base, and expanding retail book. Bajaj Finance remains the safest long-term …",positive,0.792751
