date,title,source,link,summary,sentiment_label,sentiment_score
2025-10-14,All You Need To Know Going Into Trade On Tuesday,NewsAPI - Ndtvprofit.com,https://www.ndtvprofit.com/markets/stock-market-today-all-you-need-to-know-going-into-trade-on-october-14-2025,"The benchmark indices slightly underperformed in comparison to the broader market indices. The Nifty 50 ended 0.23% down at 25,227.35 and Sensex closed 0.21% lower at 82,327.05 on Monday. Nifty Oct futures is down by 0.35% to 25,321 at a premium of 94 points.…",negative,0.969943
2025-10-14,"Buy, Sell Or Hold: LG, ITC, Tata Motors, Lemon Tree, Inox Wind, Zee, Suzlon",NewsAPI - Ndtvprofit.com,https://www.ndtvprofit.com/markets/buy-sell-or-hold-lg-electronics-itc-tata-motors-lemon-tree-hotels-inox-wind-zee-entertainment-suzlon-energy,Should you add shares of Zee Entertainment Enterprises Ltd.? Should you hold shares of LG Electronics India Ltd. at the current market price? Have you lost the chance to buy shares of Tata Motors Ltd. at an attractive price? Is it the right time to enter ITC …,neutral,0.918701
2025-10-14,"FPIs Remain Net Sellers For Second Session As Nifty, Sensex Extend Decline",NewsAPI - Ndtvprofit.com,https://www.ndtvprofit.com/markets/fpis-remain-net-sellers-for-second-session-as-nifty-sensex-extend-decline,"The foreign portfolio investors on Tuesday turned net sellers of Indian shares for the second consecutive day, after being buyers for four sessions. The FPIs sold stocks worth approximately Rs 1,509 crore, according to provisional data from the National Stock…",negative,0.682444
2025-10-14,"Sensex climbs 200 pts, Nifty above 25,250 as rally in IT stocks, soft inflation lift mood",NewsAPI - The Times of India,https://economictimes.indiatimes.com/markets/stocks/news/sensex-climbs-200-pts-nifty-above-25250-as-rally-in-it-stocks-soft-inflation-lift-mood/articleshow/124542784.cms,"Indian stock markets, Sensex and Nifty, opened higher on Tuesday, driven by strong IT sector performance following HCLTech's positive quarterly earnings. Easing retail inflation further bolstered market sentiment, increasing anticipation of a potential Reserv…",positive,0.94956
2025-10-14,"Businesses, individuals baffled over delays in clearance of cheques",NewsAPI - BusinessLine,https://www.thehindubusinessline.com/money-and-banking/businesses-individuals-baffled-over-delays-in-clearance-of-cheques/article70163177.ece,Reserve Bank of India has taken stock of the situation and is working closely with NPCI and banks to ensure smooth clearing of cheques,negative,0.903078
2025-10-14,Eternal Q2 Results: Zomato Parent To Report Quarterly Earnings On This Date - Check Details,NewsAPI - Ndtvprofit.com,https://www.ndtvprofit.com/quarterly-earnings/eternal-q2-results-zomato-parent-to-report-quarterly-earnings-on-this-date-check-details,Eternal Ltd. is set to announce the results for the second quarter of FY26 this week. Major brands in Eternal's portfolio include Zomato and Blinkit. District and Hyperpure are other businesses under Eternal. Here's everything you need to know about Eternal's…,neutral,0.948716
2025-10-14,Weekly Rupee View: Rupee eyeing a rebound,NewsAPI - BusinessLine,https://www.thehindubusinessline.com/portfolio/technical-analysis/weekly-rupee-view-rupee-eyeing-a-rebound/article70162174.ece,"Rupee remains stable against dollar despite challenges, supported by favorable factors; near-term outlook positive if resistance breaks.",positive,0.946943
2025-10-14,"CPI inflation may remain at 2.2% in FY26, below RBI's forecast of 2.6%: SBI Research",NewsAPI - BusinessLine,https://www.thehindubusinessline.com/economy/cpi-inflation-may-remain-at-22-in-fy26-below-rbis-forecast-of-26-sbi-research/article70161237.ece,"Interestingly, the decline in inflation since October 2024 has been primarily led by the food group, as its contribution moved from a large positive to a negative between October 2024 and September 2025",negative,0.886586
2025-10-14,"'Incorrect, False': TCS Reacts After Reddit User Alleges Workplace Toxicity, Denial Of Diwali Leaves",NewsAPI - Ndtvprofit.com,https://www.ndtvprofit.com/trending/no-more-diwali-leaves-reddit-user-accuses-tcs-manager-of-workplace-toxicity,"A Reddit user's post complaining about a Tata Consultancy Services (TCS) manager allegedly disallowing leaves during Diwali has drawn attention. The manager, according to the Redditor, announced in a team group that ""no more Diwali leaves will be approved"". N…",negative,0.930407
2025-10-14,"Axis Bank Q2 preview: Margins expected to slip, asset quality offers hope",NewsAPI - Livemint,https://www.livemint.com/industry/banking/axis-bank-q2-results-preview-margin-slip-asset-quality-loans-deposits-banks-11760430302918.html,"Analysts expect Axis Bank to report the sharpest sequential NIM decline among private lenders, while credit growth holds steady and asset quality offers a silver lining.",negative,0.946541
2025-10-14,Global markets tumble as Beijing imposes new ban on U.S. shipping and Bessent vows China ‘will be hurt the most’ if it doesn’t surrender,NewsAPI - Fortune,https://fortune.com/2025/10/14/stocks-global-markets-ban-us-shipping-hanwha-bessent-china-hurt-the-most/,"China holds an unexpectedly strong hand in the trade war, and the U.S.’s tariffs have been counterintuitively positive for China.",negative,0.92581
2025-10-14,"Markets slip into red mid-session as financial, metal stocks drag indices",NewsAPI - BusinessLine,https://www.thehindubusinessline.com/markets/stock-markets/markets-slip-into-red-mid-session-as-financial-metal-stocks-drag-indices/article70161684.ece,"The Sensex slipped 465 points to 81,862.34, while the Nifty 50 fell 133 points to 25,094.55. Market breadth remained weak, with over twice as many stocks declining as advancing.",negative,0.97407
2025-10-14,Infosys wins $1.6 billion deal from UK's National Health Service,NewsAPI - The Times of India,https://economictimes.indiatimes.com/tech/information-tech/infosys-wins-1-6-billion-deal-from-uks-national-health-service/articleshow/124550784.cms,"The tenure of the deal will be over a period of 15 years and to develop a workforce management solution, the country's second-largest software services company said.",positive,0.793554
2025-10-14,Visakhapatnam's AI jackpot; Lenskart IPO scoop,NewsAPI - The Times of India,https://economictimes.indiatimes.com/tech/newsletters/tech-top-5/visakhapatnams-ai-jackpot-lenskart-ipo-scoop/articleshow/124553839.cms,"Google, Adani and Airtel are partnering to build a major AI hub in Andhra Pradesh. This and more in today's ETtech Top 5.",neutral,0.508564
2025-10-14,"Earnings live: JPMorgan, BlackRock stocks edge lower, Wells Fargo rises as Q3 earnings season kicks off",NewsAPI - Yahoo Entertainment,https://finance.yahoo.com/news/live/earnings-live-jpmorgan-blackrock-stocks-edge-lower-wells-fargo-rises-as-q3-earnings-season-kicks-off-113555582.html,"Third quarter earnings season is just beginning, and analysts expect S&P 500 companies grew their profits by 8% during the quarter.",positive,0.798071
2025-10-14,"KEC order wins, Tata Motors demerger, and HCL Tech’s AI momentum key to watch: Pankaj Pandey",NewsAPI - The Times of India,https://economictimes.indiatimes.com/markets/expert-view/kec-order-wins-tata-motors-demerger-and-hcl-techs-ai-momentum-key-to-watch-pankaj-pandey/articleshow/124546523.cms,"Investors can find opportunities in KEC International, Tata Motors, and HCL Technologies. KEC International shows strong order inflows in the transmission and distribution sector. Tata Motors' demerger is expected to unlock significant shareholder value. HCL …",positive,0.858195
2025-10-14,Markets end lower as trade tensions and profit-booking weigh on sentiment,NewsAPI - BusinessLine,https://www.thehindubusinessline.com/markets/markets-end-lower-as-trade-tensions-and-profit-booking-weigh-on-sentiment/article70162676.ece,"Stock benchmarks fell on Tuesday due to US-China trade tensions, profit-booking, and low inflation, impacting investor sentiment negatively.",negative,0.973453
2025-10-14,Why India Inc lags GDP sprint despite robust growth headlines,NewsAPI - The Times of India,https://economictimes.indiatimes.com/opinion/et-commentary/why-india-inc-lags-gdp-sprint-despite-robust-growth-headlines/articleshow/124558610.cms,"India's GDP is soaring, yet this growth seems to shadow the profits of many companies. The government’s push in spending and service offerings boosts GDP, but listed firms often miss out on the windfall. Sectors like banking and IT are grappling with their ow…",negative,0.778324
2025-10-14,"Transcript: Jurrien Timmer, Director of Global Macro at Fidelity Investments",NewsAPI - Ritholtz.com,https://ritholtz.com/2025/10/transcript-jurrien-timmer/,"The transcript from this week’s, MiB: Jurrien Timmer, Director of Global Macro at Fidelity Investments, is below. You can stream and download our full conversation, including any podcast extras, on Apple Podcasts, Spotify, YouTube, and Bloomberg. All of our e…",neutral,0.950051
2025-10-14,"Vijay Mallya slams Indian banks, says they should be ‘ashamed’ over recovery transparency",NewsAPI - The Times of India,https://economictimes.indiatimes.com/news/india/vijay-mallya-slams-indian-banks-says-they-should-be-ashamed-over-recovery-transparency/articleshow/124542452.cms,"Fugitive businessman Vijay Mallya has criticized Indian public sector banks for allegedly withholding details of asset recoveries. He stated that the banks should be ashamed for not providing a full account, especially after the Union Finance Minister confirm…",negative,0.902671
2025-10-14,"Meghan, Duchess of Sussex, Selena Gomez, and the IMF—all on the same stage",NewsAPI - Fortune,https://fortune.com/2025/10/14/mpw-meghan-selena-gomez-the-imf/,Also: All the news and watercooler chat from Fortune.,neutral,0.938487
2025-10-14,Diwali stocks to buy: Over 50 ideas from top brokerages as Nifty likely near inflection point,NewsAPI - The Times of India,https://economictimes.indiatimes.com/markets/stocks/news/diwali-stocks-to-buy-over-50-ideas-from-top-brokerages-as-nifty-likely-near-inflection-point/articleshow/124542441.cms,Indian stocks are set for a strong performance after a year of stagnation. Brokerages are recommending over 50 stocks for the upcoming Samvat 2082. This optimism is fueled by attractive valuations and projections of double-digit earnings growth. Sectors like …,positive,0.92153
2025-10-14,"Lower fund costs to lift NBFC margins, MSME stress stays",NewsAPI - The Times of India,https://economictimes.indiatimes.com/markets/stocks/earnings/lower-fund-costs-to-lift-nbfc-margins-msme-stress-stays/articleshow/124540692.cms,"NBFCs anticipate a boost from lower funding costs in Q2, potentially improving net interest margins. However, purchase deferrals due to GST cuts and ongoing asset quality concerns, particularly in MSME and microfinance portfolios, could temper earnings. Vehic…",positive,0.925455
2025-10-14,"Tech Mahindra posts modest revenue growth, but margins hit new high",NewsAPI - Livemint,https://www.livemint.com/companies/tech-mahindra-q2-results-revenue-fy25-information-technology-sector-growth-software-services-11760451630902.html,"The Pune-based IT services company reported $1.59 billion in revenue for the July-September period, up 1.4% sequentially but down 0.2% on a yearly basis. Most of the growth came from manufacturers, which made up three-fifths of the company’s incremental reven…",negative,0.916926
2025-10-14,Google Cloud and Bharti Airtel prep $15bn AI hub in India,NewsAPI - TelecomTV,https://www.telecomtv.com/content/telcos-and-ai-channel/google-cloud-and-bharti-airtel-prep-15bn-ai-hub-in-india-54051/,Google Cloud has teamed up with Indian telco Bharti Airtel to develop a major AI datacentre in Andhra PradeshThe 1 gigawatt datacentre facility will be built o…,positive,0.770198
2025-10-14,"Diwali Picks: Market experts pick their festive favourites across energy, PSU and defence sectors",NewsAPI - The Times of India,https://economictimes.indiatimes.com/markets/expert-view/diwali-picks-market-experts-pick-their-festive-favourites-across-energy-psu-and-defence-sectors/articleshow/124544760.cms,"Market experts shared their top stock picks for Diwali, spanning PSU banks, energy majors, defence, and new-age platforms. Recommendations include JSW Energy, PSU banks, OMCs, Shipping Corporation of India, Bharat Electronics, SBI, Mahindra & Mahindra, Chola …",neutral,0.891327
2025-10-14,Two Brothers rides India's organic food wave with ₹110 crore funding,NewsAPI - Livemint,https://www.livemint.com/companies/start-ups/two-brothers-organic-farms-funding-indian-organic-food-market-organic-food-startups-india-11760415257655.html,"India's organic food market is booming, and large FMCG companies are investing in such brands, signalling growing consumer awareness around clean labels and nutrition among consumers.",positive,0.877165
2025-10-14,Technology Magazine Unveils Its List of the Top 100 Technology Companies of 2025,NewsAPI - GlobeNewswire,https://www.globenewswire.com/news-release/2025/10/14/3166452/0/en/Technology-Magazine-Unveils-Its-List-of-the-Top-100-Technology-Companies-of-2025.html,"London, UK – 14 October, 2025 – Technology Magazine, part of BizClik, has released its highly anticipated Top 100 Technology Companies 2025 report. The annual ranking celebrates the organisations driving global innovation, digital resilience, and technologica…",neutral,0.849212
2025-10-14,"HCL Tech shares gain 3% despite muted Q2. Should you buy, sell, or hold the stock?",NewsAPI - The Times of India,https://economictimes.indiatimes.com/markets/stocks/news/hcl-tech-shares-gain-3-despite-muted-q2-should-you-buy-sell-or-hold-the-stock/articleshow/124542884.cms,"HCL Technologies' shares rallied despite reporting flat Q2 net profit. Revenue from operations saw an 11% year-on-year increase. Analysts offer mixed views, with targets ranging from Rs 1,600 to Rs 1,800, citing deal wins and AI growth as key drivers.",positive,0.541592
2025-10-14,ETSA 2025: Minfy Technologies bets big on AI and talent to power its next growth phase,NewsAPI - The Times of India,https://economictimes.indiatimes.com/tech/startups/etsa-2025-minfy-technologies-bets-big-on-ai-and-talent-to-power-its-next-growth-phase/articleshow/124535461.cms,"Minfy Tech, the winner of the Bootstrap Champ prize at ETSA 2025, plans to hire 180-200 employees – primarily AI engineers – by the end of this fiscal to support its growing pipeline of generative AI solutions across healthcare, retail, manufacturing and ener…",positive,0.835524
2025-10-14,"India's Russian oil imports in April-Sept fell 8.4% Y/Y, data shows",NewsAPI - The Times of India,https://economictimes.indiatimes.com/industry/energy/oil-gas/indias-russian-oil-imports-in-april-sept-fell-8-4-y/y-data-shows/articleshow/124546787.cms,"India's Russian oil imports dropped 8.4% between April and September due to narrower discounts and tighter supplies, with refiners shifting towards Middle Eastern and U.S. sources. This reduction is also influenced by U.S. pressure and trade negotiations, as …",negative,0.97435
2025-10-14,"Consumer tech, financialization and wealth creation to define next decade: Hiren Ved",NewsAPI - The Times of India,https://economictimes.indiatimes.com/markets/expert-view/consumer-tech-financialization-and-wealth-creation-to-define-next-decade-hiren-ved/articleshow/124547564.cms,"Hiren Ved of Alchemy Capital Management foresees a decade dominated by consumer tech and platform companies, emphasizing their ability to aggregate demand and supply. He notes India's ongoing financialization, with a shift from savers to investors, creating o…",positive,0.618965
2025-10-14,"IIM Lucknow Summer Placement: Rs 3.95 lakh highest stipend, more than 580 offers",NewsAPI - The Indian Express,https://indianexpress.com/article/education/iim-lucknow-summer-placement-rs-3-95-lakhs-per-month-highest-stipend-mba-cat-10305771/,IIM Lucknow Summer Placement: The median stipend recorded this year is Rs. 1.72 lakhs per month in comparison to Rs 1.50 lakhs per month from the previous year.,positive,0.41346
2025-10-14,Tata Motors shares to trade ex-CV business from today. What it means for shareholders,NewsAPI - The Times of India,https://economictimes.indiatimes.com/markets/stocks/news/tata-motors-shares-to-trade-ex-cv-business-from-today-what-it-means-for-shareholders/articleshow/124541923.cms,"Tata Motors’ long-awaited demerger takes effect today, splitting its passenger and commercial vehicle operations into two listed entities — TMPV and TMLCV. Brokerages see the move unlocking value through sharper focus, with valuations hinging on JLR’s recover…",positive,0.829641
2025-10-14,Q2 spoiler alert: Over 50 companies staring at double-digit profit slump could hit your portfolio,NewsAPI - The Times of India,https://economictimes.indiatimes.com/markets/stocks/news/q2-spoiler-alert-over-50-companies-staring-at-double-digit-profit-slump-could-hit-your-portfolio/articleshow/124542938.cms,"India Inc's Q2 earnings season is set for a mixed outcome, with over 50 companies anticipating double-digit profit slumps, particularly in auto, metals, and banking. Despite these individual declines, overall market earnings are expected to remain stable, dri…",negative,0.953771
2025-10-14,"DPIIT seeks inputs on ecomm FDI; ETSA 2025 Bootstrap Champ bets on AI, talent",NewsAPI - The Times of India,https://economictimes.indiatimes.com/tech/newsletters/morning-dispatch/dpiit-seeks-inputs-on-ecomm-fdi-etsa-2025-bootstrap-champ-bets-on-ai-talent/articleshow/124540917.cms,Happy Tuesday! The central government is seeking inputs from ecommerce and retail players on foreign investment rules. This and more in today's ETtech Morning Dispatch.,neutral,0.924126
2025-10-14,"As tourists check into Uttar Pradesh, so do branded hotels",NewsAPI - The Times of India,https://economictimes.indiatimes.com/industry/services/hotels-/-restaurants/as-tourists-check-into-uttar-pradesh-so-do-branded-hotels/articleshow/124542561.cms,"Uttar Pradesh is experiencing a significant surge in branded hotel investments, from luxury heritage homestays to new airport locations. This boom is fueled by a dramatic increase in tourist numbers, prompting major hospitality groups to announce numerous new…",positive,0.912642
2025-10-14,"Tata Electronics acquires Chinese iPhone supplier Justech's India unit for about $100 million, sources say",NewsAPI - CNBC,https://www.cnbc.com/2025/10/14/tata-electronics-buys-chinese-iphone-supplier-justech-india-unit.html,Tata Electronics seeks to expand iPhone manufacturing capacity as Apple aims to make all of the iPhones intended for the U.S. market in India by end-2026.,positive,0.908555
2025-10-14,Market Surveillance Software Market - Global Forecast to 2030: Niche Players Such As Palantir Technologies Push the Boundaries of Predictive Risk Modeling,NewsAPI - GlobeNewswire,https://www.globenewswire.com/news-release/2025/10/14/3166338/28124/en/Market-Surveillance-Software-Market-Global-Forecast-to-2030-Niche-Players-Such-As-Palantir-Technologies-Push-the-Boundaries-of-Predictive-Risk-Modeling.html,"Market surveillance software presents growth opportunities by leveraging AI, machine learning, and cloud computing to enhance risk management and compliance. Demand is driven by the need for seamless integration, real-time insights, and adaptable solutions to…",positive,0.760461
2025-10-14,Tata Motors demerger: Trucks and buses business valued at Rs 260.75 per share,NewsAPI - The Times of India,https://economictimes.indiatimes.com/markets/stocks/news/tata-motors-demerger-trucks-and-buses-business-valued-at-rs-260-75-per-share/articleshow/124551445.cms,"Following Tata Motors’ demerger, the commercial vehicle unit is valued at Rs 260.75 per share, while the parent now focuses on passenger vehicles and JLR. Analysts call the split a “value unlocking” move, offering investors clearer visibility and sharper busi…",positive,0.898889
2025-10-14,Bengaluru poor roads under fire once again: Kiran Mazumdar-Shaw asks why roads are so bad; ministers say 'work in progress',NewsAPI - The Times of India,https://economictimes.indiatimes.com/news/bengaluru-news/bengaluru-poor-roads-under-fire-once-again-kiran-mazumdar-shaw-asks-why-roads-are-so-bad-ministers-say-work-in-progress/articleshow/124546898.cms,"Biocon Chairperson Kiran Mazumdar-Shaw has voiced concerns about Bengaluru's poor roads and garbage problem. An overseas visitor questioned the city's infrastructure, comparing it unfavorably to China. Government ministers acknowledge ongoing work but suggest…",negative,0.939166
2025-10-14,"India's Russian oil imports in April-Sept fell 8.4% Y/Y, data shows",NewsAPI - BusinessLine,https://www.thehindubusinessline.com/markets/commodities/indias-russian-oil-imports-in-april-sept-fell-84-yy-data-shows/article70161747.ece,"India reduces Russian oil imports due to U.S. pressure, favoring Middle Eastern and American oil sources, impacting trade negotiations.",negative,0.972409
2025-10-14,Did Tata Motors shares really crash 40%? What the demerger plunge actually means,NewsAPI - The Times of India,https://economictimes.indiatimes.com/markets/stocks/news/did-tata-motors-shares-really-crash-40-what-the-demerger-plunge-actually-means/articleshow/124543657.cms,"Tata Motors Demerger: Tata Motors shares experienced a notional 40% drop as its commercial vehicles business demerged into a new entity, TMLCV. The parent company, renamed TMPV, will now focus on passenger vehicles, EVs, and JLR. Brokerages anticipate clearer…",negative,0.967835
2025-10-14,"Nomura values Tata Motors passenger and commercial arms nearly equal, flags near-term volatility post demerger",NewsAPI - The Times of India,https://economictimes.indiatimes.com/markets/stocks/news/nomura-values-tata-motors-passenger-and-commercial-arms-nearly-equal-flags-near-term-volatility-post-demerger/articleshow/124546768.cms,"Nomura maintains a neutral stance on Tata Motors post-demerger, valuing PV and CV units almost equally, highlighting improving PV momentum, steady CV prospects, but cautioning technical risks and short-term volatility.",positive,0.834287
