date,title,source,link,summary,sentiment_label,sentiment_score
2025-10-03,"MFI heavy banks to be most impacted by ECL model, say experts",NewsAPI - BusinessLine,https://www.thehindubusinessline.com/money-and-banking/mfi-heavy-banks-to-be-most-impacted-by-ecl-model-say-experts/article70121785.ece,"RBI's shift to ECL model for banks will impact microfinance-focused banks the most, requiring higher provisioning for loans.",negative,0.566185
2025-10-03,"Reliance Industries shares in focus as co eyes Rs 30,000 crore packaged water market with Campa Sure",NewsAPI - The Times of India,https://economictimes.indiatimes.com/markets/stocks/news/reliance-industries-shares-in-focus-as-co-eyes-rs-30000-crore-packaged-water-market-with-campa-sure/articleshow/124282111.cms,"Reliance share price: RIL's arm Reliance Consumer Products is entering India’s Rs 30,000 crore packaged water market with its new brand, Campa Sure. The company aims to disrupt the segment through competitive pricing, partnerships with regional bottlers, and …",negative,0.665131
2025-10-03,"Adani, Reliance among six private firms exploring small modular nuclear reactors",NewsAPI - The Times of India,https://economictimes.indiatimes.com/industry/energy/power/adani-reliance-among-six-private-firms-exploring-small-modular-nuclear-reactors/articleshow/124290002.cms,Six major Indian companies show interest in Bharat small modular reactors. Reliance Industries and Adani Power are among them. They identified sixteen probable sites across six states. NPCIL extended the proposal deadline to March next year. These reactors wi…,neutral,0.881919
2025-10-03,"Axis Securities picks MGL, HDFC Bank among top 15 picks with upside potential of up to 30%",NewsAPI - Economictimes.com,https://m.economictimes.com/markets/stocks/news/axis-securities-picks-mgl-hdfc-bank-among-top-15-picks-with-upside-potential-of-up-to-30/axis-securities-top-stock-picks-for-fy26/slideshow/124283023.cms,"As Indian equities navigate a shifting macroeconomic environment, Axis Securities has reiterated its confidence in the country’s long-term growth trajectory. The brokerage has maintained its Nifty target of 25,500 for March 2026, supported by expectations of …",positive,0.95033
2025-10-03,Bombay HC dismisses Anil Ambani’s petition against SBI’s ‘fraud’ classification to RCom loan account,NewsAPI - The Times of India,https://economictimes.indiatimes.com/news/india/bombay-hc-dismisses-anil-ambanis-petition-against-sbis-fraud-classification-to-rcom-loan-account/articleshow/124290999.cms,"The Bombay High Court dismissed Anil Ambani's writ petition challenging the State Bank of India's decision to classify Reliance Communications' loan account as 'fraud'. The court found the plea lacked merit, upholding SBI's action taken on June 13, 2025, in a…",negative,0.747147
2025-10-03,Tata Group’s last IPO had a multibagger at listing. Can Tata Capital repeat the feat?,NewsAPI - The Times of India,https://economictimes.indiatimes.com/markets/ipos/fpos/tata-groups-last-ipo-had-a-multibagger-at-listing-can-tata-capital-repeat-the-feat/articleshow/124284477.cms,"Tata Capital will launch its Rs 15,512 crore IPO on October 6. The company is India's third-largest diversified NBFC. It operates with the Tata brand backing and high credit ratings. Investors will consider its financial performance against market competition…",positive,0.650238
2025-10-03,Loreal India sales rose 5% in FY25 amid growing competition from D2C rivals,NewsAPI - The Times of India,https://economictimes.indiatimes.com/industry/cons-products/fmcg/loreal-india-sales-rose-5-in-fy25-amid-growing-competition-from-d2c-rivals/articleshow/124290445.cms,"L'Oréal India's sales growth slowed to 5% in FY25 amidst rising competition from D2C brands, though net profit increased 23% due to reduced ad spending. Despite this, India remains a core strategic market, with the company aiming to significantly boost produc…",positive,0.931456
2025-10-03,Bank holiday today: Are banks closed on October 3 for Durga Puja and Dasain? Check full schedule here,NewsAPI - Livemint,https://www.livemint.com/industry/banking/bank-holiday-today-sikkim-gangtok-october-3-durga-puja-and-dasain-long-weekend-saturday-sunday-check-full-rbi-schedule-11759458350810.html,"This week, various parts of India will observe bank holidays for Durga Puja, Navratri, and Gandhi Jayanti. October 2025 will feature 21 official bank holidays, including religious festivities and weekend leaves.",neutral,0.925642
2025-10-03,US Senators pose nine questions to TCS on hiring practices in America H-1B approach,NewsAPI - Freerepublic.com,https://freerepublic.com/focus/f-chat/4344067/posts,"US Senators have asked India's largest IT firm TCS to furnish details about its hiring practices in the US, whether the company has displaced any Americans with H-1B workers, as well as wage parity between H-1B hires and its local US staff. In a recent letter…",negative,0.673693
2025-10-03,Youth anxiety—what two major public issues reveal about India’s crisis of unemployment,NewsAPI - Livemint,https://www.livemint.com/opinion/online-views/ipo-india-job-creation-urban-company-physicswallah-youth-unemployment-gig-economy-factory-jobs-manufacturing-h-1b-visa-11759475556544.html,"The public offers of Urban Company and Physicswallah draw into focus two major avenues for youth employment in India—gig work and tech jobs. But the horizon is hazy. H-1B visa curbs, AI proliferation and a severe shortage of factory jobs have created a perfec…",negative,0.94582
2025-10-03,RBI proposes sweeping reforms to ease India Inc.'s foreign borrowing,NewsAPI - Livemint,https://www.livemint.com/industry/banking/rbi-external-commercial-borrowing-norms-rbi-foreign-fund-rules-11759503810503.html,RBI's plan to increase the ECB limit and widen access is a positive development for Indian companies looking to raise funds overseas at cheaper rates.,positive,0.940407
2025-10-03,All You Need To Know Going Into Trade On Friday,NewsAPI - Ndtvprofit.com,https://www.ndtvprofit.com/markets/stock-market-today-all-you-need-to-know-going-into-trade-on-oct-3-4,"The benchmark indices on Wednesday snapped their eight-day losing streak and ended in green. At the close, the Sensex rose 715.69 points, or 0.89%, to 80,983.31, while the Nifty was up 225.20 points, or 0.92%, to 24,836.30.",positive,0.908277
2025-10-03,"TCS, Cognizant and 8 others face US Senate heat over H-1B hiring amid mass layoffs",NewsAPI - BusinessLine,https://www.thehindubusinessline.com/companies/tcs-cognizant-and-8-others-face-us-senate-heat-over-h-1b-hiring-amid-mass-layoffs/article70120878.ece,"Tata Consultancy Services (TCS), Cognizant and eight other major corporations have been questioned by US Senators for filing thousands of H-1B skilled labour visa petitions after conducting “mass layoffs” of American employees.",negative,0.967627
2025-10-03,"'Only talk, no action': Mohandas Pai hits out at 'JNU-type leftists' who always crib about India not building Google, Microsoft",NewsAPI - The Times of India,https://economictimes.indiatimes.com/news/new-updates/only-talk-no-action-mohandas-pai-hits-out-at-jnu-type-leftists-who-always-crib-about-india-not-building-google-microsoft/articleshow/124283294.cms,"Former Infosys CFO Mohandas Pai defended the Indian tech industry against critics, stating it created 60 lakh jobs despite abuse from ""cyber bullies"" and ""leftists."" He challenged detractors to build something themselves, emphasizing the industry's hard-won s…",negative,0.653004
2025-10-03,"D2C beauty brands like Sugar, Renee, Fae attract rising investor funding in 2025",NewsAPI - The Times of India,https://economictimes.indiatimes.com/industry/cons-products/fashion-/-cosmetics-/-jewellery/d2c-beauty-brands-like-sugar-renee-fae-attract-rising-investor-funding-in-2025/articleshow/124296651.cms,"Homegrown D2C beauty brands continue attracting significant investor funding, with $63.1 million raised by 20 leading brands from January to September 2025. This surge, nearly tripling since 2020, is driven by high margins, e-commerce growth, and strategic ac…",positive,0.938809
2025-10-03,Procurement As A Service Market Outlook 2025–2032: Strong CAGR of 11.8% with USD 17.17 Billion Valuation,NewsAPI - GlobeNewswire,https://www.globenewswire.com/news-release/2025/10/03/3161023/0/en/Procurement-As-A-Service-Market-Outlook-2025-2032-Strong-CAGR-of-11-8-with-USD-17-17-Billion-Valuation.html,"Burlingame, CA, Oct. 03, 2025 (GLOBE NEWSWIRE) -- Global Procurement As a Service Market size is estimated to be valued at USD 7.86 Bn in 2025 and is expected to reach USD 17.17 Bn by 2032, exhibiting a compound annual growth rate (CAGR) of 11.8% from 2025 to…",positive,0.93161
2025-10-03,TCS layoffs severance packages: A detailed breakdown of who may get what as the IT giant cuts 2% of its workforce,NewsAPI - The Times of India,https://economictimes.indiatimes.com/news/new-updates/tcs-layoffs-severance-packages-a-detailed-breakdown-of-who-may-get-what-as-the-it-giant-cuts-2-of-its-workforce/articleshow/124285862.cms,"Tata Consultancy Services is offering severance packages to long-serving employees whose skills no longer align with evolving company needs. This restructuring impacts staff who haven't upskilled or are unallocated, with packages ranging from three months' no…",negative,0.961454
2025-10-03,"Bajaj Housing Finance Q2 update: Disbursals rise 32% YoY to Rs 15,900 cr; AUM up 24%",NewsAPI - The Times of India,https://economictimes.indiatimes.com/markets/stocks/news/bajaj-housing-finance-q2-update-disbursals-rise-32-yoy-to-rs-15900-cr-aum-up-24/articleshow/124292296.cms,"Bajaj Housing Finance reported strong Q2 FY26 performance with disbursals rising 32% YoY to ₹15,900 crore and AUM growing 24% to ₹1.27 lakh crore, highlighting robust housing credit demand and steady loan book expansion.",positive,0.953001
2025-10-03,"Stocks to buy in 2025 for long term: TCS, Sun Pharma among 5 stocks that could give 14-36% return",NewsAPI - Economictimes.com,https://m.economictimes.com/markets/stocks/news/stocks-to-buy-in-2025-for-long-term-tcs-sun-pharma-among-5-stocks-that-could-give-14-36-return/brokerage-recommendations/slideshow/124281126.cms,"Brokerage firms have come out with their latest stock recommendations, highlighting opportunities across IT, pharma, financials, and healthcare for the next 12 months.We have collated a list of recommendations from top brokerage firms from ETNow and other sou…",neutral,0.881311
2025-10-03,"Yes Bank Q2 update: Advances grow 6.5% YoY, deposits see 7% uptick",NewsAPI - The Times of India,https://economictimes.indiatimes.com/markets/stocks/news/yes-bank-q2-update-advances-grow-6-5-yoy-deposits-see-7-uptick/articleshow/124292531.cms,"Yes Bank reported a 6.5% YoY increase in loans to ₹2.50 lakh crore and a 7.1% rise in deposits to ₹2.97 lakh crore in Q2 FY26, with CASA reaching ₹1.00 lakh crore.",positive,0.953618
2025-10-03,Weekly Global IPv4 Routing Table Report,NewsAPI - Seclists.org,https://seclists.org/nanog/2025/Oct/6,"Posted by Routing Table Analysis Role Account via NANOG on Oct 03This is an automated weekly mailing describing the state of the Global
IPv4 Routing Table as seen from APNIC's router in Japan.

The posting is sent to APOPS, NANOG, AfNOG, SANOG, PacNOG, SAFNOG…",neutral,0.947491
2025-10-03,Ethane Market Industry Report 2025-2035: Global Ethane Market to Reach USD 21.45 Billion by 2035 - Report Reveals 4.04% CAGR Growth,NewsAPI - GlobeNewswire,https://www.globenewswire.com/news-release/2025/10/03/3161062/28124/en/Ethane-Market-Industry-Report-2025-2035-Global-Ethane-Market-to-Reach-USD-21-45-Billion-by-2035-Report-Reveals-4-04-CAGR-Growth.html,"The ethane market offers growth opportunities through innovations like non-oxidative dehydrogenation and bio-based ethane, catering to energy and manufacturing sectors. Rising demand in Asia and North America, driven by sustainable solutions and ethylene prod…",positive,0.894456
2025-10-03,"The Big Jump by Leigh Brackett, Ace",NewsAPI - Fontsinuse.com,https://fontsinuse.com/uses/72185/the-big-jump-by-leigh-brackett-ace,"Contributed by Florian HardwigSource: www.abebooks.com biblioboy (edited). License: All Rights Reserved. The Big Jump is a science fiction novel by Leigh Brackett (1915–1978), the “Queen of Space Opera”. Originally published in the February 1953 issue of Spac…",neutral,0.918659
2025-10-03,Kiki Dee Band – “How glad I am” / “Peter” Dutch single cover,NewsAPI - Fontsinuse.com,https://fontsinuse.com/uses/10282/kiki-dee-band-how-glad-i-am-peter-dutch-singl,"Contributed by Johannes VandenheuvelSource: www.ebay.de geluidsdragers. License: All Rights Reserved. ITC Busorama Bold with both its forms for A and E as well as the alternate H with extended crossbar, for the Dutch release of “How glad I am”. The single mad…",neutral,0.921478
2025-10-03,Punjab records 22% growth in GST collection in first half of FY26,NewsAPI - BusinessLine,https://www.thehindubusinessline.com/news/national/punjab-records-22-growth-in-gst-collection-in-first-half-of-fy26/article70119995.ece,"Punjab sees 22.35% rise in GST collection to ₹13,971 crore, showing strong enforcement actions against tax evasion",positive,0.951074
2025-10-03,"Data Governance Market Poised for Growth, Expected to Hit USD 16.93 Billion by 2032, says Coherent Market Insights",NewsAPI - GlobeNewswire,https://www.globenewswire.com/news-release/2025/10/03/3161021/0/en/Data-Governance-Market-Poised-for-Growth-Expected-to-Hit-USD-16-93-Billion-by-2032-says-Coherent-Market-Insights.html,"Burlingame, CA, Oct. 03, 2025 (GLOBE NEWSWIRE) -- The Data Governance Market is estimated to be valued at USD 4.75 Bn in 2025 and is expected to reach USD 16.93 Bn by 2032, growing at a compound annual growth rate (CAGR) of 19.9% from 2025 to 2032. The global…",positive,0.890831
2025-10-03,Feuersprünge by Elwyn Chamberlain,NewsAPI - Fontsinuse.com,https://fontsinuse.com/uses/50144/feuerspruenge-by-elwyn-chamberlain,"Contributed by Florian HardwigPhoto: Florian Hardwig. License: CC BY-SA. 

Gates of Fire is a novel by artist, film maker and author Elwyn Chamberlain (1927–2014), originally published by Grove Press in 1978. Shown here is the cover of Heyne’s German paperbac…",neutral,0.941434
