date,title,source,link,summary,sentiment_label,sentiment_score
2025-10-14,Tata Capital’s listing adds to trend of tepid debuts among big-ticket IPOs,NewsAPI - The Times of India,https://economictimes.indiatimes.com/markets/stocks/news/tata-capitals-listing-adds-to-trend-of-tepid-debuts-among-big-ticket-ipos/articleshow/124540516.cms,"Tata Capital's stock began trading on Monday at ₹330, a slight increase from its IPO price. The debut was as anticipated, with analysts suggesting rich valuations limited immediate gains. The company's market capitalization reached ₹1,40,547.61 crore. Tata Ca…",positive,0.926127
2025-10-14,"Earnings live: JPMorgan, Citi, and other Wall Street banks set to lead off Q3 earnings season",NewsAPI - Yahoo Entertainment,https://finance.yahoo.com/news/live/earnings-live-jpmorgan-citi-and-other-wall-street-banks-set-to-lead-off-q3-earnings-season-202336019.html,"Third quarter earnings season is just beginning, and analysts expect S&P 500 companies grew their profits by 8% during the quarter.",positive,0.944243
2025-10-14,Sinha chairs 36th meeting of Executive Council of SMVDU,NewsAPI - Statetimes.in,https://statetimes.in/sinha-chairs-36th-meeting-of-executive-council-of-smvdu/,"JAMMU: Lieutenant Governor Manoj Sinha chaired the 36th meeting of Executive Council of Shri Mata Vaishno Devi University (SMVDU), at Raj Bhawan on Monday. The meeting was attended by Prof. (Dr.) Pragati Kumar, Vice Chancellor, SMVDU; Prof. Umesh Rai, Vice Ch…",neutral,0.93322
2025-10-14,Can HCLTech sustain its revenue momentum after a strong September quarter?,NewsAPI - The Times of India,https://economictimes.indiatimes.com/markets/stocks/earnings/can-hcltech-sustain-its-revenue-momentum-after-a-strong-september-quarter/articleshow/124540705.cms,"HCLTech's September quarter revenue grew better than anticipated, marking a return to sequential growth. Profit growth met expectations. The company is focusing on AI services and intellectual property. New deal wins showed strong momentum, particularly in sm…",positive,0.957538
2025-10-14,Why ITC Hotels’ Revamped Loyalty Program Matters,NewsAPI - Skift,http://skift.com/2025/10/13/why-itc-hotels-revamped-loyalty-program-matters/,"Loyalty programs are the biggest marketing avenues for the new-age Indian traveler, and ITC Hotels has decided to take things up a notch by incentivizing long-term loyalty.",positive,0.525322
2025-10-14,"PL Capital sees Indian markets holding steady despite tariffs, FII outflows, and trade uncertainty",NewsAPI - BusinessLine,https://www.thehindubusinessline.com/markets/pl-capital-sees-indian-markets-holding-steady-despite-tariffs-fii-outflows-and-trade-uncertainty/article70162575.ece,"PL Capital report: Indian markets resilient despite challenges, predicts growth in select sectors, updates Nifty targets, and stock recommendations.",positive,0.904584
2025-10-14,Global markets tumble as Beijing imposes new ban on U.S. shipping and Bessent vows China ‘will be hurt the most’ if it doesn’t surrender,NewsAPI - Yahoo Entertainment,https://finance.yahoo.com/news/global-markets-tumble-beijing-imposes-101818085.html,China showed no signs of backing down from President Trump’s trade war.,negative,0.944715
2025-10-14,"Sensex, Nifty drag amid metals & financial stocks selloff; LG Electronics India surges",NewsAPI - BusinessLine,https://www.thehindubusinessline.com/markets/stock-markets/sensex-nifty-drag-amid-metals-financial-stocks-selloff-lg-electronics-india-surges/article70161882.ece,"Tata Motors, Tech Mahindra, Wipro, HCL Tech led gainers, while Bajaj Finance, Tata Steel, JSW Steel, Hindalco and Axis Bank dragged the most.",positive,0.560941
2025-10-14,Dubai court orders NMC founder BR Shetty to pay Rs 381 crore to SBI over ‘nonsensical’ guarantee lies,NewsAPI - The Indian Express,https://indianexpress.com/article/world/dubai-court-orders-nmc-founder-br-shetty-to-pay-rs-381-crore-to-sbi-over-nonsensical-guarantee-lies-10307147/,"Justice Andrew Moran delivered the verdict on October 8, describing Shetty’s testimony as “an incredible parade of lies” and calling his evidence “incoherent and nonsensical” during the trial on September 29.",negative,0.894154
2025-10-14,RBL Bank shares gain over 3% as Emirates NBD readies majority stake purchase. Check details,NewsAPI - The Times of India,https://economictimes.indiatimes.com/markets/stocks/news/rbl-bank-shares-gain-over-3-as-emirates-nbd-readies-majority-stake-purchase-check-details/articleshow/124544061.cms,"RBL Bank shares surged over 3% following news that Emirates NBD is negotiating a ₹15,000 crore investment, potentially becoming the majority shareholder with a 51% stake. The infusion will recapitalise the bank. Despite a 46% year-on-year profit drop in Q1 FY…",negative,0.573123
2025-10-14,IPO-bound EAAA Alternatives raises $60 million from EIB for energy transition fund,NewsAPI - The Times of India,https://economictimes.indiatimes.com/markets/bonds/ipo-bound-eaaa-alternatives-raises-60-million-from-eib-for-energy-transition-fund/articleshow/124556346.cms,"EAAA Alternatives secured a $60 million commitment from the European Investment Bank for its $300 million India Energy Transition Fund, targeting renewable energy, energy storage, electric mobility, and other green infrastructure projects. The fund supports c…",positive,0.754948
2025-10-14,"European stocks near two-week low on trade worries, Michelin slump",NewsAPI - The Times of India,https://economictimes.indiatimes.com/markets/stocks/news/european-stocks-near-two-week-low-on-trade-worries-michelin-slump/articleshow/124548457.cms,European stocks dipped on Tuesday on renewed worries about a U.S.-China trade war and as Michelin's shares slid to a more than two-year low after the French tyre maker cut its annual forecast.,negative,0.972209
2025-10-14,Interise Trust to raise over Rs 20 billion via bonds: Bankers,NewsAPI - The Times of India,https://economictimes.indiatimes.com/markets/bonds/interise-trust-to-raise-over-rs-20-billion-via-bonds-bankers/articleshow/124544421.cms,"Interise Trust is set to raise 20.75 billion rupees via two bond series. These bonds will mature in 19 years, five months, and 15 days. Coupons will be 6.96% and 7.3014%, paid quarterly. Staggered redemption begins December 31, 2025. One issue has a three-yea…",neutral,0.951384
2025-10-14,RBI likely to set cut-off yield on India's 8-9 year state bonds in 7.12%-7.17% band: Poll,NewsAPI - The Times of India,https://economictimes.indiatimes.com/markets/bonds/rbi-likely-to-set-cut-off-yield-on-indias-8-9-year-state-bonds-in-7-12-7-17-band-poll/articleshow/124545043.cms,"Indian states plan to raise a combined 128 billion rupees through bond sales on Tuesday, with maturities ranging from four to 30 years.  Traders anticipate the Reserve Bank of India will set cutoff yields for 8-9 year bonds within the 7.12%-7.17% range, refle…",neutral,0.602019
2025-10-14,Pre-market action: Here's the trade setup for today's session,NewsAPI - The Times of India,https://economictimes.indiatimes.com/markets/stocks/news/pre-market-action-heres-the-trade-setup-for-todays-session/articleshow/124540831.cms,"Indian equities opened flat, breaking a two-day winning streak due to renewed global trade tensions. Analysts anticipate a range-bound market, influenced by Q2 earnings and evolving tariff developments. Despite institutional inflows and strong domestic fundam…",negative,0.772183
2025-10-14,"Banking stocks drag Nifty Bank lower in morning trade, down 0.52%",NewsAPI - BusinessLine,https://www.thehindubusinessline.com/markets/stock-markets/banking-stocks-drag-nifty-bank-lower-in-morning-trade-down-052/article70161505.ece,"Nifty Bank slips 296 points to 56,328 as IndusInd, Canara, and Axis lead losses. Ten of twelve banks in red; HDFC, ICICI see mild dip, Federal Bank gains",negative,0.969687
2025-10-14,"Market Wrap: Sensex slips 297 pts, Nifty dips below 25,150 as banks drag D-St lower for Day 2",NewsAPI - The Times of India,https://economictimes.indiatimes.com/markets/stocks/news/market-wrap-sensex-slips-297-pts-nifty-dips-below-25150-as-banks-drag-d-st-lower-for-day-2/articleshow/124549669.cms,"Indian benchmark indices Sensex and Nifty closed lower for a second straight day, impacted by a decline in financial stocks. In contrast, LG Electronics India achieved a remarkable market debut, listing at a significant 50% premium to its issue price, marking…",negative,0.948504
2025-10-14,Google readies $15 billion war chest for Andhra AI hub: all you need to know,NewsAPI - The Times of India,https://economictimes.indiatimes.com/tech/technology/google-readies-15-billion-war-chest-for-andhra-ai-hub-all-you-need-to-know/articleshow/124550659.cms,"The project will be built with an investment of $15 billion spread over five years, till 2030. The facility will have an initial capacity of 1 gigawatt (GW), which will be scaled to “multiple gigawatts”, said Google Cloud CEO Thomas Kurian.",neutral,0.741467
2025-10-14,"Nifty prediction today – October 14, 2025: Nifty 50 futures: Intraday outlook is unclear. Stay out of the market",NewsAPI - BusinessLine,https://www.thehindubusinessline.com/portfolio/technical-analysis/nifty-prediction-today-october-14-2025-nifty-50-futures-intraday-outlook-is-unclear-stay-out-of-the-market/article70161321.ece,"Nifty 50 struggles with follow-through rise, trading at 25,217; support at 25,150 crucial for market direction today.",neutral,0.592178
2025-10-14,How India’s billion-dollar IPOs have performed since 2020,NewsAPI - BusinessLine,https://www.thehindubusinessline.com/markets/how-indias-billion-dollar-ipos-have-performed-since-2020/article70161513.ece,"LG Electronics India lists at 50% premium to issue price, marking India’s best billion-dollar IPO debut since Zomato in 2021.",positive,0.826048
2025-10-14,Google to invest $15 billion to set up India’s first AI hub in Vizag,NewsAPI - BusinessLine,https://www.thehindubusinessline.com/info-tech/google-to-invest-15-billion-to-set-up-indias-first-ai-hub-in-vizag/article70161844.ece,"Google to invest $15 billion in India's first AI hub in Visakhapatnam, boosting digital infrastructure and fostering entrepreneurial creativity.",positive,0.810575
2025-10-14,Airtel-Google Partner For $15 Billion AI Hub In Visakhapatnam,NewsAPI - Ndtvprofit.com,https://www.ndtvprofit.com/business/airtel-google-partner-for-15-billion-ai-hub-in-visakhapatnam,"Bharti Airtel entered into a partnership with Google to set up India’s first Artificial Intelligence hub in Visakhapatnam, Andhra Pradesh on Wednesday.
This initiative will accelerate the adoption of AI across India, strengthen the country’s digital backbone …",positive,0.907705
2025-10-14,Ahead of Market: 10 things that will decide stock market action on Wednesday,NewsAPI - The Times of India,https://economictimes.indiatimes.com/markets/stocks/news/ahead-of-market-10-things-that-will-decide-stock-market-action-on-wednesday/articleshow/124556186.cms,"Indian markets ended lower for the second straight session, weighed by financial stocks and weak sentiment. The Sensex dropped 297 points while Nifty slipped 82 points. However, LG Electronics India made a stellar debut, listing at a 50% premium — the stronge…",negative,0.966998
2025-10-14,India’s AI ambitions supercharged with Google’s $15-billion data centre investment,NewsAPI - Livemint,https://www.livemint.com/companies/ai-ambitions-google-15-billion-data-centre-microsoft-investment-meta-adani-reliance-l-t-big-tech-renewable-energy-11760451512639.html,"The Mountain View, California-based tech giant’s largest investment in India pushes Big Tech’s ‘announced’ AI infrastructure bets in the country to $25 billion this year, with another $6.5 billion likely but unconfirmed.",positive,0.854135
2025-10-14,Infosys ends mega-deal drought with $1.6 bn UK contract,NewsAPI - Livemint,https://www.livemint.com/companies/infosys-1-6-billion-contract-mega-deal-uk-public-healthcare-giant-nhs-tcs-hcl-cognizant-it-outsourcers-ceo-parekh-11760438508647.html,"The deal is expected to fetch Infosys upwards of $107 million every year until 2040. The deal ends the Bengaluru-based software service provider's two-year drought in mega deals, or contracts valued over $1 billion.&nbsp;",positive,0.601476
2025-10-14,"India's CPI inflation may remain at 2.2% in FY26, below RBI's forecast of 2.6%: SBI Research",NewsAPI - The Times of India,https://economictimes.indiatimes.com/news/economy/indicators/indias-cpi-inflation-may-remain-at-2-2-in-fy26-below-rbis-forecast-of-2-6-sbi-research/articleshow/124550578.cms,"India's Consumer Price Index (CPI) inflation for FY26 is expected to remain at 2.2 per cent, much lower than the Reserve Bank of India's (RBI) forecast of 2.6 per cent, according to a report by the State Bank of India (SBI).",negative,0.95326
2025-10-14,Loan growth outpaces deposits—will banks be compelled to hike FD rates?,NewsAPI - Livemint,https://www.livemint.com/industry/banking/loan-growth-outpaces-deposits-banks-fund-crunch-11760339058640.html,"In the September quarter, loan and deposit growth remained strong across public, private, and small finance banks. However, advances outpaced deposits for most major lenders, provisional data show, indicating a renewed gap between credit and deposit growth.",positive,0.893079
2025-10-14,Ficci Announces Anant Goenka As President-Elect For 2025-26,NewsAPI - Ndtvprofit.com,https://www.ndtvprofit.com/business/ficci-announces-anant-goenka-as-president-elect-for-2025-26,"The Federation of Indian Chambers of Commerce and Industry or FICCI on Tuesday announced Anant Goenka, vice chairman of the RPG Group as the President-Elect of FICCI for the year 2025-26.",neutral,0.94292
2025-10-14,4 Diwali 2025 cracker stock picks from Kunal Bothra and Ashish Ashish Chaturmohta,NewsAPI - The Times of India,https://economictimes.indiatimes.com/markets/expert-view/4-diwali-2025-cracker-stock-picks-from-kunal-bothra-and-ashish-ashish-chaturmohta/articleshow/124526129.cms,"Market experts Kunal Bothra and Ashish Chaturmohta are identifying top stock picks for Diwali 2025. These selections span telecom, aviation, energy, and banking. Bharti Hexacom and Petronet LNG are recommended for short-term gains. IndiGo is a long-term prosp…",neutral,0.846331
2025-10-14,"Prabhudas Lilladher says Nifty could rise to 28,781; adds 4 stocks as high conviction picks",NewsAPI - The Times of India,https://economictimes.indiatimes.com/markets/stocks/news/prabhudas-lilladher-says-nifty-could-rise-to-28781-adds-4-stocks-as-high-conviction-picks/articleshow/124550119.cms,"Prabhudas Lilladher Capital has hiked its 12-month Nifty target to 28,781, expecting sustained domestic outperformance driven by banks, autos, NBFCs, and metals. The brokerage added five high-conviction stocks, projecting 12% annual EPS growth and highlightin…",positive,0.952387
2025-10-14,Infosys wins £1.2 billion NHS contract; signals revival for Indian IT,NewsAPI - BusinessLine,https://www.thehindubusinessline.com/info-tech/infosys-wins-12-billion-nhs-contract-signals-revival-for-indian-it/article70163566.ece,"For the second quarter, Infosys is expected to outperform its counterparts, with a stable performance that can be attributed to deal ramp-ups and a gradual recovery in the discretionary IT spending in primary markets.",positive,0.956302
2025-10-14,"Earnings live: JPMorgan, BlackRock, Wells Fargo, Johnson & Johnson take spotlight as Q3 earnings kick off",NewsAPI - Yahoo Entertainment,https://finance.yahoo.com/news/live/earnings-live-jpmorgan-blackrock-wells-fargo-johnson--johnson-take-spotlight-as-q3-earnings-kick-off-113555421.html,"Third quarter earnings season is just beginning, and analysts expect S&P 500 companies grew their profits by 8% during the quarter.",positive,0.94489
2025-10-14,"Google to invest $15 billion on AI hub in Vizag with Adani, Airtel",NewsAPI - BusinessLine,https://www.thehindubusinessline.com/info-tech/google-to-invest-15-billion-on-ai-hub-in-vizag-with-adani-airtel/article70162547.ece,"Google invests $15 billion in India's first AI hub in Visakhapatnam, boosting connectivity and innovation globally.",positive,0.913107
2025-10-14,"Bharti Telecom raises Rs 10,500 crore in twin bond issue; mutual funds, insurers lead demand",NewsAPI - The Times of India,https://economictimes.indiatimes.com/markets/bonds/bharti-telecom-raises-rs-10500-crore-in-twin-bond-issue-mutual-funds-insurers-lead-demand/articleshow/124556293.cms,"Bharti Telecom raised ₹10,500 crore through two bond issues of ₹5,250 crore each — India’s largest such domestic issue this fiscal. Major mutual funds, insurers, and pension funds subscribed, reflecting strong demand. Proceeds will refinance upcoming debt mat…",positive,0.887184
2025-10-14,"Airtel, Google to build AI hub in Visakhapatnam",NewsAPI - The Times of India,https://economictimes.indiatimes.com/tech/artificial-intelligence/airtel-google-to-build-indias-first-ai-hub-in-visakhapatnam/articleshow/124547580.cms,"Bharti Airtel and Google has entered into a partnership to set up an AI hub in Andhra Pradesh's Visakhapatnam, with support from AdaniConneX. The $15 billion project, spread over five years, includes a dedicated data centre and a cable landing station to host…",positive,0.836753
2025-10-14,ICICI Prudential Life Q2 Results: Net profit up 18% to Rs 296 crore,NewsAPI - The Times of India,https://economictimes.indiatimes.com/markets/stocks/earnings/icici-prudential-life-q2-profit-up-18-pc-to-rs-296-cr/articleshow/124549026.cms,"ICICI Prudential Life Insurance Company on Tuesday reported 18 per cent growth in consolidated net profit at Rs 296 crore for three months ended September 30, 2025.",positive,0.951855
2025-10-14,MCX India shares jump 6% to hit fresh 52-Week high; HDFC Securities maintains “Buy”,NewsAPI - The Times of India,https://economictimes.indiatimes.com/markets/stocks/news/mcx-india-shares-jump-6-to-hit-fresh-52-week-high-hdfc-securities-maintains-buy/articleshow/124546318.cms,"MCX India shares surged to a 52-week high, driven by robust gold and silver trading. HDFC Securities maintains a “Buy” rating with a Rs 10,000 target, citing strong options volumes, product launches, and steady revenue growth through FY25-28.",positive,0.944719
2025-10-14,"Anant Raj Ltd raises Rs 1,100 crore via QIP",NewsAPI - The Times of India,https://economictimes.indiatimes.com/markets/stocks/news/anant-raj-ltd-raises-rs-1100-crore-via-qip/articleshow/124547930.cms,"Realty developer Anant Raj has successfully raised Rs 1,100 crore through a qualified institutional placement. This significant funding will fuel the expansion of its data center and cloud infrastructure business. The company aims for substantial growth in th…",positive,0.920548
2025-10-14,"Dow Jones crashes 400 points, S&P 500, Nasdaq 1% on US-China tensions; bank results pour in",NewsAPI - The Times of India,https://economictimes.indiatimes.com/markets/stocks/news/dow-jones-crashes-400-points-sp-500-nasdaq-1-on-us-china-tensions-bank-results-pour-in/articleshow/124554024.cms,"Wall Street's main indexes opened lower on Tuesday with renewed trade tensions between U.S. and China souring sentiment, while investors also parsed results from big U.S. banks that kicked off the third-quarter earnings season.",negative,0.969421
2025-10-14,GSTR-9 annual return FY 2024-25: Key change in reporting Table 6 explained,NewsAPI - The Times of India,https://economictimes.indiatimes.com/wealth/tax/gstr-9-annual-return-fy-2024-25-key-change-in-reporting-table-6-explained/articleshow/124544921.cms,"A significant change has been introduced in the GSTR-9 annual return form. This update, effective for FY 2024-25 with a December 31, 2025 deadline, introduces a new table for reporting input tax credit from the previous year. This aims to enhance clarity and …",neutral,0.821038
2025-10-14,"Google, Adani, Airtel join hands to build India’s largest $15-billion AI data hub in Visakhapatnam",NewsAPI - The Times of India,https://economictimes.indiatimes.com/industry/telecom/telecom-news/google-adani-airtel-join-hands-to-build-indias-largest-15-billion-ai-data-hub-in-visakhapatnam/articleshow/124547550.cms,"Google, Adani Enterprises, and Bharti Airtel are investing $15 billion over five years to build India's largest AI hub and data centre campus in Visakhapatnam. This initiative will feature gigawatt-scale data centres powered by clean energy, new subsea cable …",neutral,0.53394
2025-10-14,Infosys Wins $1.6 Billion UK Healthcare Deal To Modernize Workforce Platform,NewsAPI - Biztoc.com,https://biztoc.com/x/d9dfeb8c9c6a3f94,"Infosys Limited (NYSE:INFY) on Tuesday announced that it has been awarded a £1.2 billion ($1.59 billion), 15-year contract by the NHS Business Services Authority (NHSBSA) to deliver the Future NHS Workforce Solution.
Infosys will develop a cutting-edge, data-…",positive,0.91333
2025-10-14,From code to concrete: The new TCS playbook to build factories that power AI,NewsAPI - Livemint,https://www.livemint.com/companies/tcs-india-data-centre-ai-revolution-11760439780451.html,India’s largest IT services exporter is shifting its identity from a pure software services provider to a digital infrastructure powerhouse. A massive $6.5 billion bet to forge one gigawatt of new data centre capacity is at the centre of this pivot.,neutral,0.683167
2025-10-14,Infosys multiplies UK public sector revenue by 160 with £1.2bn NHS deal,NewsAPI - ComputerWeekly.com,https://www.computerweekly.com/news/366632687/Infosys-multiplies-UK-public-sector-revenue-by-160-with-12bn-NHS-deal,Gone are the days of Indian IT suppliers being shunned in UK government contracts through job and security fears,negative,0.95677
2025-10-14,"ET Market Watch: Sensex, Nifty slip for 2nd day, LG shines with 50% premium debut",NewsAPI - The Times of India,https://economictimes.indiatimes.com/markets/stocks/etmarkets-podcast/et-market-watch-sensex-nifty-slip-for-2nd-day-lg-shines-with-50-premium-debut/podcast/124557034.cms,"The Sensex slipped 297 points to close at 82,029, while the Nifty lost 82 points to settle at 25,145.",negative,0.891003
2025-10-14,"Nifty Bank prediction today – October 14, 2025: Nifty Bank futures: Hovering near a support, might witness a rebound",NewsAPI - BusinessLine,https://www.thehindubusinessline.com/portfolio/technical-analysis/nifty-bank-prediction-today-october-14-2025-nifty-bank-futures-hovering-near-a-support-might-witness-a-rebound/article70161354.ece,"Nifty Bank index down 0.20%, futures show bullish trend with support at 56,760, buy now for potential uptick.",negative,0.761951
2025-10-14,"TCS, Google Cloud ink pact to integrate Gemini Enterprise for workforce and customers",NewsAPI - Livemint,https://www.livemint.com/companies/tcs-google-cloud-ink-pact-to-integrate-gemini-enterprise-for-workforce-customers-11760430319017.html,"The AI agents offered by Google Cloud through Gemini Enterprise are integrated with Google Cloud's infrastructure and AI solutions, including BigQuery, which supports some of TCS's internal systems.",neutral,0.679243
2025-10-14,Why Are FIIs Avoiding India? Morgan Stanley's Ridham Desai Lists Three Reasons,NewsAPI - Ndtvprofit.com,https://www.ndtvprofit.com/markets/why-are-fiis-not-investing-in-india-ridham-desai-lists-three-reasons-ahead-of-samvat-2082,"Ridham Desai, MD & Chief Equity Strategist - India at Morgan Stanley, believes lack of an artificial intelligence trade could be one of the reasons why foreign investors are not investing in India, as he laid out three reasons why India remains underweight on…",neutral,0.849369
2025-10-14,I found I had Stage 4 colon cancer after a ski accident. My broken tailbone saved my life.,NewsAPI - Business Insider,https://www.businessinsider.com/ski-accident-doctors-detect-my-stage-4-cancer-2025-10,Liz Healy had a skiing accident so doctors ordered scans. Results showed cancer.  She has fought the disease and is about to run the 2025 NYC marathon.,neutral,0.896642
2025-10-14,"Bharti Telecom raises ₹10,500 crore through bonds to refinance maturing debt",NewsAPI - Livemint,https://www.livemint.com/industry/bharti-telecom-refinances-debt-with-bond-sale-11760439589030.html,"The company reportedly has debt securities worth  ₹9,750 crore that are due to mature in November-December, and has total bonds worth  ₹16,150 crore set to mature during 2027-2034.",neutral,0.594946
2025-10-14,Tata Capital shares in focus after steady debut; brokerages see up to 10% upside,NewsAPI - The Times of India,https://economictimes.indiatimes.com/markets/stocks/news/tata-capital-shares-in-focus-after-steady-debut-brokerages-see-up-to-10-upside/articleshow/124542978.cms,"Tata Capital shares: Tata Capital made a modest market debut, listing 1.23% above its issue price and closing 1.4% higher. Despite the subdued start, analysts at Emkay Global and JM Financial initiated coverage with ‘buy’ ratings and a target price of ₹360, s…",positive,0.92811
2025-10-14,"Nifty Support At 25,050 As Consolidation Likely Ahead Of Diwali",NewsAPI - Ndtvprofit.com,https://www.ndtvprofit.com/markets/trade-setup-nse-nifty-50-bank-support-resistance-levels-outlook-october-15-2025,"The NSE Nifty 50 has found support at around 25,050 and 25,000, with analysts expecting consolidation to continue ahead of the festive season, according to analysts. The daily chart indicates that Nifty has formed a black candle, with the Nifty continuing to …",positive,0.697292
