date,title,source,link,summary,sentiment_label,sentiment_score
2025-09-19,Consumer Services Sees Highest FPI Outflows In First Half Of September; Automobile Leads Inflows,NewsAPI - Ndtvprofit.com,https://www.ndtvprofit.com/markets/consumer-services-sees-highest-fpi-outflows-in-first-half-of-september-automobile-leads-inflows,"The consumer service stocks witnessed highest fortnightly outflows by overseas investors as foreign portfolio investors pulled $368 million from consumer service stocks during the first half of September, according to data released by National Securities Depo…",positive,0.656837
2025-09-19,Asahi India Glass Board Approves Allotment Of 1.18 Crore Shares To Eligible QIP At Issue Price,NewsAPI - Ndtvprofit.com,https://www.ndtvprofit.com/markets/asahi-india-glass-share-price-board-approves-allotment-of-118-crore-shares-to-eligible-qip-at-issue-price,"Asahi India Glass Ltd., has approved issue and allotment of 1.18 crore shares to eligible qualified institutional placement at issue price of Rs 844.79 per share.",neutral,0.847824
2025-09-19,"Vedanta Rejects 'Malicious' Short-Seller Report, Denies Singapore Police Probe",NewsAPI - Ndtvprofit.com,https://www.ndtvprofit.com/markets/vedanta-rejects-malicious-short-seller-report-denies-singapore-police-probe,"A Vedanta spokesperson has compleltely rejected allegations made in a short seller's recent report, describing them as ""malicious and ill-informed."" In a formal statement, the company directly addressed claims of an ongoing investigation by the Singapore Poli…",negative,0.904161
2025-09-19,"Need finality of proceedings in AGR dispute, SC tells Vi, DoT",NewsAPI - BusinessLine,https://www.thehindubusinessline.com/news/need-finality-of-proceedings-in-agr-dispute-sc-tells-vi-dot/article70071105.ece,"Supreme Court seeks resolution in Vodafone Idea's AGR dues litigation, hearing scheduled for September 26.",neutral,0.622561
2025-09-19,"Supreme Court defers hearing Vodafone’s plea against new ₹9,450 cr demand after govt seeks more time",NewsAPI - Livemint,https://www.livemint.com/companies/news/vodafone-idea-supreme-court-agr-dues-9450-crore-demand-11758255591033.html,"Vodafone Idea has challenged the government’s fresh  ₹9,450 crore demand towards adjusted gross revenue citing an earlier Supreme Court order. The outcome could decide whether India’s third-largest carrier gets breathing space to survive.",negative,0.891095
2025-09-19,How GST Cuts Will Impact Household Expenditure From Sept 22,NewsAPI - Ndtvprofit.com,https://www.ndtvprofit.com/economy-finance/goods-and-services-tax-gst-reforms-what-gets-cheaper-for-urban-households-from-september-22-2025,"Urban households will see a shift in their monthly spending patterns when the new rates of the goods and services tax take effect on Sept. 22. According to an analysis by the Federation of Indian Chambers of Commerce and Industry, and the Thought Arbitrage Re…",neutral,0.8441
2025-09-19,17 Richest Last Names and Famous Families Behind Wealth,NewsAPI - Ahouseinthehills.com,https://ahouseinthehills.com/richest-last-names-and-famous-families-behind-wealth/,"When I hear names like Walton, Al Saud, or Hermès, I instantly think of wealth and power. You probably do too. These last names aren’t just labels; they’re dynasties tied to business empires, oil reserves, and luxury legacies, unlike the extraordinary example…",neutral,0.933132
2025-09-19,Zelle chief Denise Leonhard says a lack of humor at work ‘kills creativity and makes people want to work less’,NewsAPI - Fortune,https://fortune.com/2025/09/19/zelle-chief-denise-leonhard-says-a-lack-of-humor-at-work-kills-creativity-and-makes-people-want-to-work-less/,Also: All the news and watercooler chat from Fortune.,negative,0.673787
2025-09-19,"ITC's Nepal plans unchanged despite unrest, says Chairman Sanjiv Puri",NewsAPI - The Times of India,https://economictimes.indiatimes.com/industry/cons-products/fmcg/itcs-nepal-plans-unchanged-despite-unrest-says-chairman-sanjiv-puri/articleshow/124002598.cms,"ITC Ltd. remains committed to its long-term investment plans in Nepal, despite recent unrest, with expansion in FMCG and hotels proceeding as planned. Chairman Sanjiv Puri acknowledges global uncertainties as the norm, emphasizing the need for businesses to a…",positive,0.880009
2025-09-19,"SBI Foundation to support 23,230 meritorious students under Asha Scholarship; commits ₹90 crore",NewsAPI - BusinessLine,https://www.thehindubusinessline.com/news/education/sbi-foundation-to-support-23230-meritorious-students-under-asha-scholarship-commits-90-crore/article70069455.ece,"SBI Foundation launches ₹90 crore SBI Platinum Jubilee Asha Scholarship 2025, empowering 23,230 students from underprivileged backgrounds.",positive,0.809237
2025-09-19,"Up to 7.30% FD interest rate: IDBI Bank extends Utsav FD deadline to invest, revises fixed deposit interest rates, check latest FD rates",NewsAPI - The Times of India,https://economictimes.indiatimes.com/wealth/invest/up-to-7-30-fd-interest-rate-idbi-bank-extends-utsav-fd-deadline-to-invest-revises-fixed-deposit-interest-rates-check-latest-fd-rates/articleshow/123990723.cms,"IDBI Bank has updated its fixed deposit interest rates, effective September 19, 2025, impacting regular FDs and the Utsav FD scheme. General citizens can now earn between 3% and 6.55%, while senior citizens can earn between 3.50% and 7.05% on deposits less th…",neutral,0.904868
2025-09-19,SC to hear Vodafone Idea's plea against additional AGR dues raised by DoT on September 26,NewsAPI - BusinessLine,https://www.thehindubusinessline.com/info-tech/sc-to-hear-vodafone-ideas-plea-against-additional-agr-dues-raised-by-dot-on-september-26/article70069475.ece,"The plea of Vodafone sought directions to quash the additional demand of AGR dues, saying that it belonged to the pre-2016-17 period that had been settled by the Supreme Court's earlier ruling",neutral,0.441174
2025-09-19,"iPhone 17 sale starts in India; Check prices, and how to get the brand new phone at just Rs 62,000 under this Apple offer",NewsAPI - The Times of India,https://economictimes.indiatimes.com/news/new-updates/iphone-17-sale-starts-in-india-check-prices-and-how-to-get-the-brand-new-phone-at-just-rs-63000-under-this-apple-offer/articleshow/123988884.cms,"Apple has launched its iPhone 17 series and iPhone Air in India. The lineup includes iPhone 17, Pro, Pro Max, and the Air. These models boast ProMotion displays and upgraded cameras. Storage starts at 256GB. The iPhone 17 uses the A19 chip. Pro models have th…",neutral,0.910155
2025-09-19,Yes Bank eyes wealth foray after deal with Japan’s SMBC,NewsAPI - The Times of India,https://economictimes.indiatimes.com/industry/banking/finance/banking/yes-bank-eyes-wealth-foray-after-deal-with-japans-smbc/articleshow/124001155.cms,"Yes Bank is planning to enter wealth management after partnering with Sumitomo Mitsui Banking Corporation. India's wealthy population is growing, creating opportunities. Yes Bank will compete with major private banks and non-bank players. The bank aims to fin…",positive,0.838356
2025-09-19,GK Energy IPO opens today; price band ₹145-153 per share,NewsAPI - BusinessLine,https://www.thehindubusinessline.com/markets/gk-energy-ipo-opens-today-price-band-145-153-per-share/article70068442.ece,"GK Energy IPO opens at ₹145-153 per share, raising ₹465 crore. Anchor investors commit ₹139 cr; IPO closes on September 23. Strong growth and PM-KUSUM tie-up.",positive,0.894746
2025-09-19,"BluSmart seeks to salvage over 4,000 cabs leased from Gensol amid bankruptcy",NewsAPI - Livemint,https://www.livemint.com/companies/blusmart-seeks-to-salvage-over-4-000-cabs-leased-from-gensol-amid-bankruptcy-11758195112404.html,"BluSmart, which had leased more than 4,000 electric cars from Gensol—over half its overall fleet—is trying to ensure that Gensol does not reassign the leases unilaterally to other ride-hailing companies.",neutral,0.76516
2025-09-19,"Cable TV service provider Satlinks alleges price bias, Star denies; TDSAT steps in",NewsAPI - The Times of India,https://economictimes.indiatimes.com/industry/telecom/telecom-news/cable-tv-service-provider-satlinks-alleges-price-bias-star-denies-tdsat-steps-in/articleshow/124002248.cms,The Telecom Disputes Settlement and Appellate Tribunal (TDSAT) is addressing a petition by Satlinks against Star India over alleged pricing bias and billing disputes. Satlinks claims inflated charges and discriminatory rates affecting its subscriber base. Sta…,negative,0.872255
2025-09-19,Q-comm’s festive hustle gets faster; GST cuts taxing for EVs,NewsAPI - The Times of India,https://economictimes.indiatimes.com/tech/newsletters/morning-dispatch/q-comms-festive-hustle-gets-faster-gst-cuts-taxing-for-evs/articleshow/123987723.cms,Quick commerce companies are preparing for the festive season by adding dark stores. This and more in today's ETtech Morning Dispatch.,neutral,0.901672
2025-09-19,No family savings or support. 24-year-old earning Rs 29k monthly decodes his expenses and asks internet for advice to buy a house,NewsAPI - The Times of India,https://economictimes.indiatimes.com/magazines/panache/no-family-savings-or-support-24-year-old-earning-rs-29k-monthly-decodes-his-expenses-and-asks-internet-for-advice-to-buy-a-house/articleshow/123993756.cms,"A 24-year-old is diligently saving to buy a house despite earning a modest Rs 29,000 monthly. He has already saved ₹3 lakh, including an emergency fund and dedicated house savings, by prioritizing savings and family support. He allocates a significant portion…",neutral,0.882118
2025-09-19,Gemini prompts aren’t just for selfies; they could rescue your bank account too,NewsAPI - Livemint,https://www.livemint.com/money/personal-finance/gemini-prompts-aren-t-just-for-selfies-they-could-rescue-your-bank-account-too-personal-finance-financial-planning-11758268912077.html,"AI edits are trending on social media, but the same technology can help manage finances.",neutral,0.918605
2025-09-19,"District by Zomato focused on acquiring users, pilots in the ‘going out’ business",NewsAPI - Livemint,https://www.livemint.com/companies/district-by-zomato-eternal-district-app-online-event-ticketing-india-quick-commerce-growth-11758203072988.html,"While Zomato transposed its old dining out business as is in its newest app District, the company is running experiments such as offline shopping coupons and salon deals along with tentpole concerts and events to acquire new customers, CEO Rahul Ganjoo said.",neutral,0.808049
2025-09-19,Weekly Global IPv4 Routing Table Report,NewsAPI - Seclists.org,https://seclists.org/nanog/2025/Sep/210,"Posted by Routing Table Analysis Role Account via NANOG on Sep 19This is an automated weekly mailing describing the state of the Global
IPv4 Routing Table as seen from APNIC's router in Japan.

The posting is sent to APOPS, NANOG, AfNOG, SANOG, PacNOG, SAFNOG…",neutral,0.948129
2025-09-19,"Rs 15,000 crore! Top 10 stocks that saw highest promoter & other insider selling in 2025",NewsAPI - Economictimes.com,https://m.economictimes.com/markets/stocks/news/rs-15000-crore-top-10-stocks-that-saw-highest-promoter-other-insider-selling-in-2025/taking-stock/slideshow/123991510.cms,"From January 1 to September 16, a handful of leading companies saw their insiders offload significant shares, Nuvama’s latest report shows. It’s been a year mostly filled with steep slides followed by moderately sharp rebounds. While some promoters snapped up…",negative,0.891839
2025-09-19,Fetal Bovine Serum Market Size to Hit USD 6.03 Billion by 2033 Due to Increasing Demand for Cell-based Research and Biopharmaceutical Production | S&S Insider,NewsAPI - GlobeNewswire,https://www.globenewswire.com/news-release/2025/09/19/3153161/0/en/Fetal-Bovine-Serum-Market-Size-to-Hit-USD-6-03-Billion-by-2033-Due-to-Increasing-Demand-for-Cell-based-Research-and-Biopharmaceutical-Production-S-S-Insider.html,The U.S. market alone is projected to hit USD 1.83 billion by 2033 as cell culture and vaccine research accelerate. The U.S. market alone is projected to hit USD 1.83 billion by 2033 as cell culture and vaccine research accelerate.,positive,0.825033
2025-09-19,AIFF secures full ownership of ISL!,NewsAPI - Rediff.com,https://www.rediff.com/sports/report/aiff-secures-full-ownership-of-isl/20250919.htm,"India's top-tier football league can no longer be owned or operated by private players as per the AIFF's new Constitution approved by the Supreme Court, which mandated the sport's apex body to take sole ownership of the product.",neutral,0.945982
2025-09-19,Feathers fly in dispute over Ambani zoo's pursuit of rare parrot,NewsAPI - The Star Online,https://www.thestar.com.my/news/world/2025/09/19/feathers-fly-in-dispute-over-ambani-zoo039s-pursuit-of-rare-parrot,"NEW DELHI/BRASILIA (Reuters) -This is a story about a bird and a family. But this is no ordinary bird, and this is no ordinary family. Read full story",neutral,0.89934
2025-09-19,Pathogen-induced damage in Drosophila: Uncoupling disease tolerance from resistance,NewsAPI - Plos.org,https://journals.plos.org/plospathogens/article?id=10.1371/journal.ppat.1013482,"Author summary Host immune response against infections can be divided into mechanisms of resistance that ensure active pathogen elimination, and mechanisms of disease tolerance, which include processes that return the host to physiological homeostasis without…",neutral,0.935793
