date,title,source,link,summary,sentiment_label,sentiment_score
2025-10-13,Great Customer Service Will Be People And Bots Working Together,NewsAPI - Forbes,https://www.forbes.com/sites/davidbirch/2025/10/12/great-customer-service-will-be-people-and-bots-working-together/,We area long way from understanding what kind of customer service it will take to surprise and delight my agent as opposed to what it will take to surprise and delight me,neutral,0.901962
2025-10-13,"TCS data centre pivot has strong India angle, to hire more locals in US: CEO",NewsAPI - The Times of India,https://timesofindia.indiatimes.com/city/bengaluru/tcs-data-centre-pivot-has-strong-india-angle-to-hire-more-locals-in-us-ceo/articleshow/124509558.cms,"Bengaluru: TCS's subpar performance highlights a muted demand environment, driven by weak client sentiment and a pullback in discretionary spending, w.",negative,0.947361
2025-10-13,"AIFF adopts SC-approved constitution, leaves out contentious clauses pending Apex court direction",NewsAPI - The Indian Express,https://indianexpress.com/article/sports/football/aiff-adopts-sc-approved-constitution-contentious-clauses-10303245/,"The SC had on September 19 approved the draft constitution of the AIFF prepared by former apex court judge L Nageswara Rao with certain modifications, and directed the federation to adopt it within four weeks.",neutral,0.899049
2025-10-13,Infosys debuts AI-powered Customer Experience Suite for Salesforce,NewsAPI - Verdict,https://www.verdict.co.uk/infosys-ai-customer-experience-suite-salesforce/,"The suite combines Infosys Topaz, a portfolio of AI services and platforms, with Salesforce’s agentic AI.",neutral,0.753972
2025-10-13,Diwali 2025 stock picks: Brokerages recommend top long-term buys,NewsAPI - BusinessLine,https://www.thehindubusinessline.com/markets/diwali-2025-stock-picks-brokerages-recommend-top-long-term-buys/article70157313.ece,"Top Diwali 2025 stock picks include SBI, HDFC, ABB, Max Healthcare, and more. Experts expect long-term gains from 11–63 per cent for investors.",positive,0.844369
2025-10-13,ET Market Watch: Markets slip as US-China trade tensions rattle Dalal Street,NewsAPI - The Times of India,https://economictimes.indiatimes.com/markets/stocks/etmarkets-podcast/et-market-watch-markets-slip-as-us-china-trade-tensions-rattle-dalal-street/podcast/124530393.cms,"Indian equities ended the day lower on Monday, as IT stocks led the laggards amid renewed trade tensions between the US and China. The Sensex fell 174 points to close at 82,327, while the Nifty 50 slipped 58 points to 25,227.",negative,0.973558
2025-10-13,"Market Wrap: Sensex slips 173 pts, Nifty below 25,250 as US-China tariff tensions weigh",NewsAPI - The Times of India,https://economictimes.indiatimes.com/markets/stocks/news/market-wrap-sensex-slips-173-pts-nifty-below-25250-as-us-china-tariff-tensions-weigh/articleshow/124523832.cms,"Indian equity benchmarks Sensex and Nifty closed lower on Monday, with IT stocks experiencing significant declines. This downturn was triggered by renewed U.S.-China trade tensions, as President Trump escalated tariff threats following Beijing's tightening of…",negative,0.974803
2025-10-13,Infosys Collaborates with Telenor Shared Services to Modernize HR Operations with Oracle Cloud HCM,NewsAPI - Yahoo Entertainment,https://finance.yahoo.com/news/infosys-collaborates-telenor-shared-services-124345851.html,"Infosys Limited (NYSE:INFY) is one of the best growth stocks to buy now. On October 3, Infosys announced its collaboration with Telenor Shared Services/TSS...",positive,0.816596
2025-10-13,Avenue Supermarts overvalued despite strong revenue growth: Sandip Sabharwal,NewsAPI - The Times of India,https://economictimes.indiatimes.com/markets/expert-view/avenue-supermarts-overvalued-despite-strong-revenue-growth-sandip-sabharwal/articleshow/124520646.cms,"Market strategist Sandip Sabharwal discussed Avenue Supermarts' high valuations and potential consolidation. He noted Tata Capital IPO's valuation is expensive despite a positive NBFC outlook. Sabharwal advised selectivity in real estate, favoring companies l…",neutral,0.666927
2025-10-13,Nifty sector report card,NewsAPI - BusinessLine,https://www.thehindubusinessline.com/portfolio/stock-fundamental-analysis-india/nifty-sector-report-card/article70151282.ece,"Nifty-50 performance analysis, sector-wise insights, and market outlook for various industries in the upcoming year.",neutral,0.920312
2025-10-13,"Anand James on Nifty’s path to 26,000, sector trends, and top stock picks for the week",NewsAPI - The Times of India,https://economictimes.indiatimes.com/markets/expert-view/anand-james-on-niftys-path-to-26000-sector-trends-and-top-stock-picks-for-the-week/articleshow/124505684.cms,"Geojit Investments' Anand James sees Nifty reaching 25,460 near-term and 26,000 as a realistic milestone, citing room for upside. He discusses banking and IT sector trends, tactical views on Tata Communications and BSE, and offers top trading ideas for Rajesh…",neutral,0.8609
2025-10-13,NTPC Green Energy shares in focus after MoU with Japan’s ENEOS for green hydrogen supply,NewsAPI - The Times of India,https://economictimes.indiatimes.com/markets/stocks/news/ntpc-green-energy-shares-in-focus-after-mou-with-japans-eneos-for-green-hydrogen-supply/articleshow/124516715.cms,"Shares of NTPC Green Energy Ltd (NGEL) could see attention after signing an MoU with Japan’s ENEOS to explore green methanol and hydrogen derivative supplies. The agreement, part of NGEL’s Green Hydrogen Hub at Pudimadaka, aims to boost India’s clean energy e…",positive,0.928318
2025-10-13,Vodafone Idea shares slide 2% after Supreme Court defers AGR plea hearing,NewsAPI - The Times of India,https://economictimes.indiatimes.com/markets/stocks/news/vodafone-idea-shares-slide-2-after-supreme-court-defers-agr-plea-hearing/articleshow/124520903.cms,"Vodafone Idea shares saw a dip on Monday after the Supreme Court deferred its AGR plea hearing to October 27. The delay prolongs uncertainty over the telecom giant’s Rs 5,606 crore liability, even as the government hints at a possible one-time settlement to e…",negative,0.971091
2025-10-13,"Bajaj Housing raises Rs 1000 crore in bonds, business grows 24% in Q2",NewsAPI - The Times of India,https://economictimes.indiatimes.com/markets/bonds/bajaj-housing-raises-rs-1000-crore-in-bonds-business-grows-24-in-q2/articleshow/124530573.cms,Bajaj Housing Finance has successfully raised Rs 1000 crore by selling bonds to investors. The company secured this funding at a coupon rate of 6.95%. These bonds are non-convertible debentures and will mature in January 2028. This issuance marks the lowest c…,neutral,0.636511
2025-10-13,YES Bank shares rally 10% in 3 days. What’s behind the surge?,NewsAPI - The Times of India,https://economictimes.indiatimes.com/markets/stocks/news/yes-bank-shares-rally-10-in-3-days-whats-behind-the-surge/articleshow/124519992.cms,"YES Bank shares have surged 10% over the past three sessions, touching a fresh 52-week high, as investors pile in ahead of quarterly earnings and amid renewed optimism following Japanese lender Sumitomo Mitsui Banking Corporation’s (SMBC) stake purchase.",positive,0.944713
2025-10-13,"Nifty Prediction Today – October 13, 2025: Nifty 50 Futures: Can fall more, go short",NewsAPI - BusinessLine,https://www.thehindubusinessline.com/portfolio/technical-analysis/nifty-prediction-today-october-13-2025-nifty-50-futures-can-fall-more-go-short/article70157359.ece,"Nifty 50 October Futures contract can fall to 25,120-25,100",negative,0.942955
2025-10-13,Sensex Today | Stock Market LIVE Updates: GIFT Nifty signals a negative start; Asian shares trade mixed,NewsAPI - Economictimes.com,https://m.economictimes.com/markets/stocks/live-blog/bse-sensex-today-live-nifty-stock-market-updates-13-october-2025/liveblog/124515131.cms,"Sensex Today | Stock Market LIVE Updates: The Indian market rose on Friday, buoyed by gains in major financial stocks and renewed foreign portfolio investor (FPI) inflows over the last three sessions. Positive sentiment ahead of the quarterly earnings season …",positive,0.923883
2025-10-13,Can US generics momentum and CDMO strength keep pharma earnings steady this quarter?,NewsAPI - The Times of India,https://economictimes.indiatimes.com/markets/stocks/earnings/can-us-generics-momentum-and-cdmo-strength-keep-pharma-earnings-steady-this-quarter/articleshow/124514758.cms,"Indian pharmaceutical companies are set for a steady September quarter. Growth in the US generics market and domestic sales will drive performance. Companies like Apollo Hospitals, Lupin, and Aurobindo are expected to show strong results. Despite some cost pr…",positive,0.956117
2025-10-13,Indian banks face slow loan growth and muted earnings in September quarter,NewsAPI - The Times of India,https://economictimes.indiatimes.com/markets/stocks/earnings/indian-banks-face-slow-loan-growth-and-muted-earnings-in-september-quarter/articleshow/124514801.cms,"Indian banks are poised for a tepid September quarter with muted earnings and loan growth, driven by a slowdown in retail and corporate segments. Analysts anticipate weaker treasury gains and potential net interest margin compression due to rising bond yields…",negative,0.971847
2025-10-13,TCS begins talks for selling stake in newly created data centre business,NewsAPI - BusinessLine,https://www.thehindubusinessline.com/info-tech/tcs-begins-talks-for-selling-stake-in-newly-created-data-centre-business/article70154670.ece,"“We are looking at an equity partner; The investment for the data center business is not only from TCS, it would be a combination of debt and equity” Sameer Seksaria, Chief Financial Officer, TCS",neutral,0.808433
2025-10-13,Markets open lower as Trump’s tariff threats trigger global uncertainty,NewsAPI - BusinessLine,https://www.thehindubusinessline.com/markets/stock-markets/markets-open-lower-as-trumps-tariff-threats-trigger-global-uncertainty/article70157303.ece,"Markets cautious as Sensex and Nifty fall on renewed U.S.-China trade tensions, with sectoral movers and technical indicators analyzed.",negative,0.940366
2025-10-13,SBI CBO result 2025 declared at sbi.co.in: Check direct link to download scorecards here,NewsAPI - The Times of India,https://timesofindia.indiatimes.com/education/news/sbi-cbo-result-2025-declared-at-sbi-co-in-check-direct-link-to-download-scorecards-here/articleshow/124525246.cms,"The State Bank of India (SBI) has declared the results for the Circle Based Officer (CBO) Recruitment Examination 2025, aiming to fill 2,964 vacancies nationwide. The exam included a 120-mark objective test and a 50-mark descriptive test. Candidates can check…",neutral,0.940473
2025-10-13,Ahead of Market: 10 things that will decide stock market action on Tuesday,NewsAPI - The Times of India,https://economictimes.indiatimes.com/markets/stocks/news/ahead-of-market-10-things-that-will-decide-stock-market-action-on-tuesday/articleshow/124531883.cms,"Indian markets closed lower on Monday, led by IT stocks, as renewed US-China trade tensions and a US government shutdown dampened investor sentiment. Analysts noted profit booking in consumption sectors and mixed Q2 earnings, though mid- and small-cap stocks …",negative,0.970377
2025-10-13,6 benefits of moving from queues to clicks for online personal loans,NewsAPI - Livemint,https://www.livemint.com/money/personal-finance/6-benefits-of-moving-from-queues-to-clicks-for-online-personal-loans-11760332010768.html,"Online personal loans offer faster approvals, minimal paperwork, flexible options, and transparent processes, making digital borrowing a convenient and secure choice for modern borrowers seeking quick financial assistance.",neutral,0.570839
2025-10-13,FPIs Turn Net Sellers Post Four-Day Buying Streak As Nifty Sees Dip,NewsAPI - Ndtvprofit.com,https://www.ndtvprofit.com/markets/fpis-turn-net-sellers-post-four-day-buying-streak-as-nifty-sees-dip,"The foreign portfolio investors on Monday turned net sellers of Indian shares, after being buyers for four sessions. The FPIs sold stocks worth approximately Rs 240 crore, according to provisional data from the National Stock Exchange. The DIIs that have stay…",neutral,0.481855
2025-10-13,"TCS eyes 5G infra market, flags interest from global telcos",NewsAPI - BusinessLine,https://www.thehindubusinessline.com/info-tech/tcs-eyes-5g-infra-market-flags-interest-from-global-telcos/article70158710.ece,"The CFO also pointed out that since the rollout, BSNL’s profitability that was in the red for years, reported positive numbers recently",positive,0.956962
2025-10-13,Stock Market Today: All You Need To Know Going Into Trade On Oct. 13,NewsAPI - Ndtvprofit.com,https://www.ndtvprofit.com/markets/stock-market-today-all-you-need-to-know-going-into-trade-on-oct-13-3,"The NSE Nifty 50 Index closed near 25,300; gaining for the second consecutive day. The Nifty closed 0.41% higher at 25,285.35, while the Sensex closed 0.40% up at 82,500.82.",positive,0.876741
2025-10-13,"Stocks in news: Tata Motors, Avenue Supermarts, Welspun Enterprises, Infosys",NewsAPI - The Times of India,https://economictimes.indiatimes.com/markets/stocks/news/stocks-in-news-tata-motors-avenue-supermarts-tata-capital-listing-and-more/articleshow/124503013.cms,"Indian stock markets finished higher on Friday. Financial stocks and foreign investor inflows boosted the Sensex and Nifty. Tata Consultancy Services' weaker earnings limited broader gains. Several companies like Avenue Supermarts, Tata Motors, and Infosys wi…",positive,0.558485
2025-10-13,SC defers till Oct 27 hearing on plea of Vodafone Idea for quashing additional AGR demand,NewsAPI - BusinessLine,https://www.thehindubusinessline.com/news/sc-defers-till-oct-27-hearing-on-plea-of-vodafone-idea-for-quashing-additional-agr-demand/article70157982.ece,The Supreme Court on Monday deferred to October 27 the hearing on a plea of telecom major Vodafone Idea Ltd. seeking quashing of the Department of Telecommunication’s (DoT) additional adjusted gross revenue (AGR) demands for the period up to 2016-17.,negative,0.764567
2025-10-13,"Sensex, Nifty decline on global trade concerns; Tata Motors, Infosys lead losers",NewsAPI - BusinessLine,https://www.thehindubusinessline.com/markets/stock-markets/top-gainers-losers-today-13th-oct-sensex-nifty-decline-on-global-trade-concerns-tata-motors-infosys-lead-losers/article70157751.ece,"Sensex traded 224.00 points or 0.27 per cent lower at 82,276.82 at 1.18 pm, and Nifty 50 was down by 74.45 points or 0.29 per cent to 25,210.90",negative,0.971212
2025-10-13,"Buy-on-dips strategy back? Angel One’s Rajesh Bhosale bets on Axis Bank, HDFC AMC",NewsAPI - The Times of India,https://economictimes.indiatimes.com/markets/expert-view/buy-on-dips-strategy-back-angel-ones-rajesh-bhosale-bets-on-axis-bank-hdfc-amc/articleshow/124524059.cms,"Indian stock markets opened lower this week as global geopolitical issues impacted investor sentiment. The Nifty 50 fell below 25,200. Analysts suggest that dips present fresh buying chances. Banking stocks, particularly Axis Bank, are showing strength. HDFC …",negative,0.930807
2025-10-13,"RBI appoints Sanjay Kumar, Sonali Sen as new EDs",NewsAPI - The Times of India,https://economictimes.indiatimes.com/markets/stocks/news/rbi-appoints-sanjay-kumar-sonali-sen-as-new-eds/articleshow/124514739.cms,"The Reserve Bank of India has appointed two new Executive Directors. Sanjay Kumar Hansda and Sonali Sen Gupta will take up their new roles soon. Gupta will oversee consumer education, financial inclusion, and inspection departments. Hansda will manage economi…",neutral,0.942871
2025-10-13,"Making Money While You Sleep: Fund Manager's Unusual Insight Draws Surprise, Skepticism",NewsAPI - Ndtvprofit.com,https://www.ndtvprofit.com/markets/making-money-while-you-sleep-fund-managers-unusual-insight-draws-surprise-skepticism,"In a surprising twist to conventional trading wisdom, a long-term analysis of the Nifty 50 has revealed that the bulk of market returns over the past 25 years have come not during trading hours, but overnight.",neutral,0.811011
2025-10-13,Infosys debuts AI-powered Customer Experience Suite for Salesforce,NewsAPI - Biztoc.com,https://biztoc.com/x/f6d2629d72c9399b,"Infosys has launched the Infosys Customer Experience Suite for Salesforce, a set of enterprise solutions designed to automate and optimise customer engagement processes.
The release extends Infosys’s collaboration with Salesforce, targeting organisations seek…",positive,0.740238
2025-10-13,"We will be a net job creator: Sudeep Kunnumal, TCS CHRO",NewsAPI - BusinessLine,https://www.thehindubusinessline.com/info-tech/we-will-be-a-net-job-creator-sudeep-kunnumal-tcs-chro/article70154684.ece,"In this conversation, Chief Financial Officer Sameer Seksaria and Chief Human Resources Officer Sudeep Kunnumal addressed these questions head-on, explaining how the company is balancing workforce readiness for its AI-led growth strategy, while maintaining ca…",neutral,0.727256
2025-10-13,Infosys kicks off employee performance review,NewsAPI - The Times of India,https://economictimes.indiatimes.com/tech/information-tech/infosys-kicks-off-employee-performance-review/articleshow/124528754.cms,"Multiple employees received an email from HR asking them to complete the process by October 17. “This is a routine exercise, but we hope the company will give us a raise this time, unlike last year,” an employee said.",negative,0.86679
2025-10-13,Investing in too many mutual funds can hurt your returns: Know what experts advise about maximum number of mutual funds to have,NewsAPI - The Times of India,https://economictimes.indiatimes.com/wealth/invest/investing-in-too-many-mutual-funds-can-hurt-your-returns-know-what-experts-advise-about-maximum-number-of-mutual-funds-to-have/articleshow/124469702.cms,Over-diversification can hurt your returns and make your portfolio impossible to track.,negative,0.942464
2025-10-13,SC upholds ITC benefit for purchaser-dealer despite selling-dealer’s failure to deposit tax,NewsAPI - BusinessLine,https://www.thehindubusinessline.com/economy/sc-upholds-itc-benefit-for-purchaser-dealer-despite-selling-dealers-failure-to-deposit-tax/article70157243.ece,"The question in this matter was whether the benefit of ITC is available to the registered purchaser-dealers who paid taxes to registered seller dealer(s) in terms of invoice(s) raised by them, even though those seller dealers did not deposit the collected tax…",neutral,0.902677
2025-10-13,The Arattai conundrum: Is Made in India enough?,NewsAPI - BusinessLine,https://www.thehindubusinessline.com/specials/emerging-entrepreneurs/the-arattai-conundrum-is-made-in-india-enough/article70151786.ece,"Vaitheeswaran K's viral tweet on Arattai's launch, Zoho's messaging platform, sparks debate on data privacy and product market fit.",negative,0.711484
2025-10-13,TCS CEO Says No New H-1B Hiring in USA.,NewsAPI - Biztoc.com,https://biztoc.com/x/ae5d3e4c654b600d,"Tata Consultancy Services (TCS) CEO K. Krithivasan has made it clear that the IT giant is not planning to hire new H-1B visa applicants in the near future.
In a recent interview, he said the company will instead focus on expanding its local workforce in the U…",neutral,0.495458
2025-10-13,"Stock Market Live Updates 13 Oct 2025: Event-heavy week for markets as investors track US-China tensions, CPI data, and earnings cues",NewsAPI - BusinessLine,https://www.thehindubusinessline.com/markets/share-market-nifty-sensex-live-updates-13th-october-2025/article70154734.ece,"Sensex, Nifty, Share Prices LIVE: Stock market investors are likely to witness a volatile week as multiple factors converge — renewed US-China tariff tensions, key domestic inflation data, and crucial Q2 earnings from major companies like HCL Tech, Infosys, a…",positive,0.472007
2025-10-13,Nifty's Next Big Test: Can It Cross This Level To Claim A New All-Time High?,NewsAPI - Ndtvprofit.com,https://www.ndtvprofit.com/markets/niftys-next-big-test-can-it-cross-this-level-to-claim-a-new-all-time-high,"The benchmark Nifty 50 index traded with a positive bias throughout the week, ending higher in four out of five trading sessions. Notably, on Friday, the index witnessed a follow-through buying and closed above the ‘Shooting Star’ candlestick pattern formed o…",positive,0.91745
2025-10-13,"TCS cutting dependence on H-1B visa, hiring more locally: CEO Krithivasan",NewsAPI - The Times of India,https://economictimes.indiatimes.com/tech/information-tech/tcs-cutting-dependence-on-h-1b-visa-hiring-more-locally-ceo-krithivasan/articleshow/124521437.cms,"Tata Consultancy Services is reducing its reliance on H-1B visas for US operations, with CEO K Krithivasan stating a significant drop in fresh applications. This strategic shift aims to foster local hiring and aligns with a broader workforce transformation. T…",positive,0.487587
2025-10-13,"Markets close lower amid US-China tariff tensions, recover from day’s lows",NewsAPI - BusinessLine,https://www.thehindubusinessline.com/markets/markets-close-lower-amid-us-china-tariff-tensions-recover-from-days-lows/article70158299.ece,"The BSE Sensex settled 173.77 points or 0.21% lower at 82,327.05, while the NSE Nifty 50 declined 58.00 points or 0.23% to close at 25,227.35",negative,0.96802
2025-10-13,"TCS results signal cautious optimism, but IT outlook remains uncertain: Dhananjay Sinha",NewsAPI - The Times of India,https://economictimes.indiatimes.com/markets/expert-view/tcs-results-signal-cautious-optimism-but-it-outlook-remains-uncertain-dhananjay-sinha/articleshow/124470253.cms,"Dhananjay Sinha of Systematix Group notes uncertainty for Indian IT due to global trends. TCS results were in line, but future growth faces headwinds. Banks are seeing margin compression, though lending activity is picking up. Public sector banks and retail l…",negative,0.822106
2025-10-13,"Construction sector revival powers strong growth in UP and Bihar, outpaces national average: Report",NewsAPI - The Times of India,https://economictimes.indiatimes.com/industry/services/property-/-cstruction/construction-sector-revival-powers-strong-growth-in-up-and-bihar-outpaces-national-average-report/articleshow/124516737.cms,"India’s construction sector revival has driven strong growth in Uttar Pradesh and Bihar, with the sector contributing 13.4% and 11.2% of the states’ GVA respectively in FY24, well above the All India average of 8.9%, according to HDFC Bank.",positive,0.954167
2025-10-13,Wall Street thinks China is winning Trump’s trade war,NewsAPI - Fortune,https://fortune.com/2025/10/13/stocks-china-trump-trade-war/,"China holds an unexpectedly strong hand in the trade war, and the U.S.’s tariffs have been counterintuitively positive for China.",positive,0.941446
2025-10-13,"HCLTech reports fastest Q2 growth in five years, calls AI revenue in a first",NewsAPI - Livemint,https://www.livemint.com/companies/hcltech-reports-fastest-q2-growth-in-five-years-calls-ai-revenue-in-a-first-11760365179969.html,"HCL Technologies Ltd reported a strong second-quarter performance with a 2.8% sequential revenue growth to $3.64 billion, surpassing estimates. The company also marked revenue from AI, contributing $100 million. HCLTech's net profit rose 8% to $486 million.",positive,0.959494
2025-10-13,Retail inflation cools to 99-month low at 1.5% in September,NewsAPI - BusinessLine,https://www.thehindubusinessline.com/economy/retail-inflation-cools-to-99-month-low-at-15-in-september/article70158969.ece,"India's retail inflation drops to 1.54% in September, lowest in 8 years, prompting debate on further rate cuts.",negative,0.972404
2025-10-13,Infosys Collaborates with Telenor Shared Services to Modernize HR Operations with Oracle Cloud HCM,NewsAPI - Biztoc.com,https://biztoc.com/x/11a3ec742d08d7f3,,positive,0.689534
2025-10-13,N Chandrasekaran Gets Historic Third Term As Tata Sons Chairman: Tracking His Journey To The Top Seat,NewsAPI - Ndtvprofit.com,https://www.ndtvprofit.com/trending/n-chandrasekaran-gets-historic-third-term-as-tata-sons-chairman-tracking-his-journey-to-the-top-seat,"Chandrasekaran can now continue as chairman of Tata Sons until 2032, reflecting the group's confidence in his leadership.",positive,0.766998
2025-10-13,H-1B visa crackdown not an existential threat to TCS; CEO Krithivasan says firm 'can survive',NewsAPI - Livemint,https://www.livemint.com/companies/news/h1b-visa-crackdown-not-an-existential-threat-to-tcs-ceo-krithivasan-says-firm-can-survive-11760337946989.html,"Krithivasan's comments take on particular importance, with TCS being the second-biggest beneficiary of the H-1B programme in 2025 after Amazon, with over 5,000 H-1B visas approved in 2025 alone.",positive,0.522901
2025-10-13,"From lending to Treasury, lenders go big on AI for core operations",NewsAPI - BusinessLine,https://www.thehindubusinessline.com/money-and-banking/from-lending-to-treasury-lenders-go-big-on-ai-for-core-operations/article70159126.ece,"Indian lenders leverage AI and ML for credit appraisal, customer experience, product development, and treasury management, transforming banking operations.",neutral,0.654333
2025-10-13,"Sensex, Nifty extend losses past midday on global trade concerns",NewsAPI - BusinessLine,https://www.thehindubusinessline.com/markets/stock-markets/sensex-nifty-extend-losses-past-midday-on-global-trade-concerns/article70157642.ece,Persistent concerns over US–China trade tensions and profit booking in IT and auto majors weighed down benchmark indices,negative,0.969211
