date,title,source,link,summary,sentiment_label,sentiment_score
2025-09-19,These Stocks to Buy Will Benefit From a Fed Rate Cut... Including This 1 Surprise Tech Stock Yielding 3%,NewsAPI - Barchart.com,https://www.barchart.com/story/news/34899911/these-stocks-benefit-from-a-fed-rate-cut-including-1-surprise-buy-yielding-nearly-3,"As expected, the Fed has lowered rates by 25 basis points at its September meeting. Here are the stocks to buy after the rate cut.",neutral,0.675531
2025-09-19,"Infosys offers Rs 50,000 for referrals of women returning to work",NewsAPI - The Times of India,https://timesofindia.indiatimes.com/city/bengaluru/infosys-offers-rs-50000-for-referrals-of-women-returning-to-work/articleshow/123983565.cms,Bengaluru: Infosys is offering rewards to employees for referring women professionals on a career break who wish to rejoin the workforce with the comp.,positive,0.733996
2025-09-19,"Day Trading Guide for September 19, 2025: Intraday supports, resistances for Nifty50 stocks",NewsAPI - BusinessLine,https://www.thehindubusinessline.com/portfolio/day-trading-guide/day-trading-guide-for-september-19/article70065805.ece,"The Day Trading Guide provides key intraday support and resistance levels to watch for on Nifty Futures and widely traded stocks such as Reliance Industries, Infosys, HDFC Bank, TCS, and SBI",neutral,0.896224
2025-09-19,"Adani stocks surge 10% as SEBI clears group; Sensex, Nifty end lower on profit-taking",NewsAPI - BusinessLine,https://www.thehindubusinessline.com/markets/adani-stocks-surge-10-as-sebi-clears-group-sensex-nifty-end-lower-on-profit-taking/article70069674.ece,"The Sensex fell 387.73 points or 0.47% to close at 82,626.23, while the Nifty 50 declined 96.55 points or 0.38% to settle at 25,327.05",negative,0.973172
2025-09-19,Chris Wood of Jefferies sells Reliance Industries shares to buy Adani stock,NewsAPI - The Times of India,https://economictimes.indiatimes.com/markets/stocks/news/chris-wood-of-jefferies-sells-reliance-industries-shares-to-buy-adani-stock/articleshow/123993135.cms,"Investor Chris Wood of Jefferies has sold Reliance Industries shares and reduced exposure to select banks, shifting focus to Ambuja Cement amid India’s long-only portfolio. The move follows RIL’s AGM announcements, including Jio Platforms’ 2026 IPO and FMCG r…",neutral,0.746566
2025-09-19,Markets consolidate in narrow band as profit-booking continues after three-day rally,NewsAPI - BusinessLine,https://www.thehindubusinessline.com/markets/stock-markets/markets-consolidate-in-narrow-band-as-profit-booking-continues-after-three-day-rally/article70069211.ece,"The indices opened marginally lower with the Nifty starting at 25,410.20 against the previous close of 25,423.60, while the Sensex opened at 82,946.04 compared to Thursday’s close of 83,013.96",negative,0.971265
2025-09-19,"Infosys, HanesBrands Announce 10-Year AI-Driven Strategic Alliance",NewsAPI - Yahoo Entertainment,https://finance.yahoo.com/news/infosys-hanesbrands-announce-10-ai-044652718.html,"Infosys Limited (NYSE:INFY) is one of the best growth stocks under $30 to buy. On September 11, Infosys and HanesBrands Inc. (NYSE:HBI) announced a strategic...",positive,0.8756
2025-09-19,"Jefferies' Chris Wood Removes RIL, Adds Adani Stock To Portfolio",NewsAPI - Ndtvprofit.com,https://www.ndtvprofit.com/markets/jefferies-chris-wood-removes-ril-adds-adani-stock-to-portfolio,"Christopher Wood, global head of equity strategy at Jefferies, has removed Reliance Industries' stock from his portfolio and added Adani Group-owned Ambuja Cements' shares. Wood has also reduced his holding in Axis Bank, ICICI Bank, REC and JSW Energy. He add…",negative,0.825822
2025-09-19,CFOs On the Move: Week ending Sept. 19,NewsAPI - CFO Magazine,https://www.cfo.com/news/cfos-on-the-move-9-19-Mike-Liberatore-OpenAI-Srinivas-Phatak-Unilever-Donald-Mulligan-Market-Basket/760539/,"Opendoor names an interim CFO, OpenAI hires former xAI CFO as business finance officer and Unilever promotes an insider to finance chief.",neutral,0.908786
2025-09-19,Financing your electric scooter is easy with the Bajaj Finserv Two-wheeler Loan,NewsAPI - BusinessLine,https://www.thehindubusinessline.com/brandhub/financing-your-electric-scooter-is-easy-with-the-bajaj-finserv-two-wheeler-loan/article70068864.ece,"With a substantial loan amount, flexible tenures and easy eligibility parameters, Bajaj Finance makes borrowing hassle-free for you.",neutral,0.814615
2025-09-19,"Motilal Oswal settles case with Sebi, pays Rs 34.85 lakh as settlement charges",NewsAPI - The Times of India,https://economictimes.indiatimes.com/markets/stocks/news/motilal-oswal-settles-case-with-sebi-pays-rs-34-85-lakh-as-settlement-charges/articleshow/123987376.cms,"Sebi has settled proceedings with Motilal Oswal Financial Services regarding a case of suspected front-running by the Chaturvedi Group, linked to a large client's trades. The brokerage paid ₹34.85 lakh as settlement charges. The regulator alleged the firm fai…",negative,0.841763
2025-09-19,Japan's 10-year bond yield rises ahead of BOJ decision,NewsAPI - The Times of India,https://economictimes.indiatimes.com/markets/bonds/japans-10-year-bond-yield-rises-ahead-of-boj-decision/articleshow/123988077.cms,"Japan's 10-year government bond yield experienced a slight increase in early trading on Friday, reaching 1.605%. Investors are keenly awaiting signals from the Bank of Japan regarding the timing of the next potential interest rate hike. The BOJ is expected to…",positive,0.919458
2025-09-19,US corporate bond dealmaking jumps day after Fed rate cut,NewsAPI - The Times of India,https://economictimes.indiatimes.com/markets/bonds/us-corporate-bond-dealmaking-jumps-day-after-fed-rate-cut/articleshow/123988107.cms,"Following the Federal Reserve's quarter-point rate cut, U.S. corporate bond deal-making surged, with over $15 billion in investment-grade bonds issued on Thursday. AT&T spearheaded the activity with a $5 billion offering for debt and acquisitions. UBS Group a…",positive,0.693864
2025-09-19,Pre-market action: Here's the trade setup for today's session,NewsAPI - The Times of India,https://economictimes.indiatimes.com/markets/stocks/news/pre-market-action-heres-the-trade-setup-for-todays-session/articleshow/123980806.cms,"Nifty gained for the third consecutive session following the US Fed rate cut and indications of further reductions. Analysts anticipate a continued upward trend, influenced by tariff-related developments. The India VIX fell, while the rupee depreciated agains…",negative,0.881816
2025-09-19,"Sebi, RBI in talks to boost trading in corporate bond index derivatives",NewsAPI - The Times of India,https://economictimes.indiatimes.com/markets/bonds/sebi-rbi-in-talks-to-boost-trading-in-corporate-bond-index-derivatives/articleshow/123997416.cms,"Securities and Exchange Board of India and the Reserve Bank of India are in discussions on corporate bond index derivatives to strengthen trading activity in corporate debt securities, Sebi whole-time member Ananth Narayan G said on Friday.",positive,0.920602
2025-09-19,Will Saatvik Green Energy IPO spark long-term value for investors?,NewsAPI - The Times of India,https://economictimes.indiatimes.com/markets/stocks/news/will-saatvik-green-energy-ipo-spark-long-term-value-for-investors/articleshow/123987460.cms,"Saatvik Green Energy, a solar module manufacturer, is planning an IPO. The company aims to raise ₹700 crore through fresh equity. It will use the funds to expand capacity and repay debt. An additional ₹200 crore will be raised through an offer for sale. The I…",positive,0.616994
2025-09-19,RBI Governor advocates fiscal discipline and borrowing calendar for state bonds,NewsAPI - The Times of India,https://economictimes.indiatimes.com/markets/bonds/rbi-governor-advocates-fiscal-discipline-and-borrowing-calendar-for-state-bonds/articleshow/123987363.cms,Reserve Bank of India Governor Sanjay Malhotra addressed state finance secretaries. He highlighted the importance of sticking to the borrowing calendar for state bonds. Malhotra emphasized fiscal discipline to boost economic growth. States need to improve spe…,neutral,0.732113
2025-09-19,"Avg housing prices in New Gurugram at nearly Rs 14K/sq ft, cheaper than main city: Magicbricks",NewsAPI - The Times of India,https://economictimes.indiatimes.com/markets/digital-real-estate/realty-news/avg-housing-prices-in-new-gurugram-at-nearly-rs-14k/sq-ft-cheaper-than-main-city-magicbricks/articleshow/123988122.cms,"New Gurugram is becoming an affordable premium real estate hub with an average property rate of Rs 13,900 per square foot and a ticket size of Rs 2.6 crore, according to Magicbricks. Premium properties exceeding 2,500 sq ft are priced lower in New Gurugram at…",neutral,0.522643
2025-09-19,"BOJ keeps interest rates steady, decides to start selling ETFs",NewsAPI - The Times of India,https://economictimes.indiatimes.com/markets/stocks/news/boj-keeps-interest-rates-steady-decides-to-start-selling-etfs/articleshow/123989780.cms,"The Bank of Japan has maintained its short-term interest rates at 0.5%. However, the central bank decided to begin selling its exchange-traded funds and real-estate investment trusts. Naoki Tamura and Hajime Takata dissented to the decision. Governor Kazuo Ue…",neutral,0.674024
2025-09-19,Rs 1 lakh question: iPhone 17 now or mutual fund for future? Vijay Kedia decodes,NewsAPI - The Times of India,https://economictimes.indiatimes.com/markets/stocks/news/rs-1-lakh-question-iphone-17-now-or-mutual-fund-for-future-vijay-kedia-decodes/articleshow/123996519.cms,"As Apple’s iPhone 17 sparks long queues and pre-orders, Vijay Kedia urges buyers to rethink spending Rs 1 lakh on a phone versus investing it for wealth creation and future gains.",neutral,0.746803
2025-09-19,"Bloomberg seeks investor feedback on including India in global bond index, document shows",NewsAPI - The Times of India,https://economictimes.indiatimes.com/markets/bonds/bloomberg-seeks-investor-feedback-on-including-india-in-global-bond-index-document-shows/articleshow/123990838.cms,"Bloomberg Index Services is gauging investor sentiment regarding the inclusion of Indian government bonds in its global aggregate index, following their addition to the emerging market local currency bond index in January 2025. With $502 billion in fully acce…",neutral,0.768976
2025-09-19,"Need finality of proceedings in AGR dispute, SC tells Vi, DoT",NewsAPI - BusinessLine,https://www.thehindubusinessline.com/info-tech/need-finality-of-proceedings-in-agr-dispute-sc-tells-vi-dot/article70071105.ece,"Supreme Court seeks resolution in Vodafone Idea's AGR dues litigation, hearing scheduled for September 26.",neutral,0.622561
2025-09-19,Two Stocks That Delivered Consistent Annual Returns For A Decade,NewsAPI - Ndtvprofit.com,https://www.ndtvprofit.com/markets/indias-most-reliable-stocks-hdfc-bank-share-price-pidilite-deliver-consistent-annual-returns-for-a-decade,"In a market where over 6,500 companies are listed, only two names have stood the test of consistency. According to NDTV Profit's calculations HDFC Bank Ltd. and Pidilite Industries Ltd. have emerged as India’s most reliable stocks, delivering positive returns…",positive,0.93547
2025-09-19,Bank Nifty dips 0.54% amid mixed performance in banking stocks,NewsAPI - BusinessLine,https://www.thehindubusinessline.com/markets/stock-markets/bank-nifty-dips-054-despite-mixed-performance-in-banking-stocks/article70068937.ece,"Bank Nifty index drops 0.54% as public sector banks gain, private sector heavyweights decline; market activity remains robust.",negative,0.967827
2025-09-19,"Inside the Fed’s economic projections, ‘something isn’t adding up’ according to SoFi investment chief",NewsAPI - Yahoo Entertainment,https://finance.yahoo.com/news/inside-fed-economic-projections-something-110448216.html,The Fed says the economy will grow and unemployment will decline. So why did it cut interest rates on Wednesday?,negative,0.823325
2025-09-19,"Adani stocks defy market slump as Sensex, Nifty retreat after recent rally",NewsAPI - BusinessLine,https://www.thehindubusinessline.com/markets/stock-markets/adani-stocks-defy-market-slump-as-sensex-nifty-retreat-after-recent-rally/article70069171.ece,"A total of 3,042 stocks were traded in the market. Out of these, 1,483 stocks advanced, while 1,446 declined and 113 remained unchanged",negative,0.603603
2025-09-19,"Nifty Prediction Today – September 19, 2025: Nifty 50 Futures: Corrective fall possible, stay out of the market",NewsAPI - BusinessLine,https://www.thehindubusinessline.com/portfolio/technical-analysis/nifty-prediction-today-september-19-2025-nifty-50-futures-corrective-fall-possible-stay-out-of-the-market/article70068682.ece,"Nifty is trading in red now. The Nifty 50 September Futures contract can fall to 25,250-25,230 on a break below 25,370",negative,0.954397
2025-09-19,"IT, banks or infra? Top sectors to watch after US Fed rate cut",NewsAPI - The Times of India,https://economictimes.indiatimes.com/markets/expert-view/it-banks-or-infra-top-sectors-to-watch-after-us-fed-rate-cut/articleshow/123978467.cms,"Indian markets have recently reached new highs, fueled by GST rationalization and easing tariff concerns. However, sustaining this rally hinges on the return of consistent FPI buying. While DIIs have provided support, trade negotiations and earnings growth wi…",positive,0.948693
2025-09-19,"Sensex sheds over 200 pts, Nifty50 below 25,400 as D-St snaps 3-day rally",NewsAPI - The Times of India,https://economictimes.indiatimes.com/markets/stocks/news/sensex-sheds-over-200-pts-nifty50-below-25400-as-d-st-snaps-3-day-rally/articleshow/123989293.cms,"Indian stocks experienced a slight downturn on Friday, halting a three-day rally. The Sensex and Nifty 50 indices both opened lower, influenced by tempered enthusiasm regarding potential U.S. Federal Reserve rate cuts and the advancement of trade discussions …",negative,0.969786
2025-09-19,"Stock Picks Today: SBI, Maruti, Cohance Lifesciences, Paytm, Axis Bank, L&T Finance On Brokerages' Radar",NewsAPI - Ndtvprofit.com,https://www.ndtvprofit.com/markets/stock-picks-today-sbi-maruti-cohance-lifesciences-paytm-axis-bank-lt-finance-on-brokerages-radar,"State Bank of India, L&T Finance Ltd., Cohance Lifesciences Ltd., One97 Communications Ltd., Axis Bank Ltd., Bank of Baroda Ltd., Maruti Suzuki India Ltd., and Indian Hotel Ltd., are among the companies garnering brokerage commentary today.",neutral,0.932035
2025-09-19,"ICICI Bank rolls out festive bonanza, offering ₹6,000 cashback on iPhone 17. Check details",NewsAPI - Livemint,https://www.livemint.com/money/personal-finance/icici-bank-rolls-out-festive-bonanza-offering-rs-6-000-cashback-on-iphone-17-check-details-11758271858039.html,"The festive bonanza also offers 10 percent off on Flipkart, upto  ₹12,500 off on Croma and 12 percent off on Makemytrip, reveals ICICI Bank's website",neutral,0.802534
2025-09-19,"Mastercard, HyperPay to launch commercial cards in Saudi Arabia",NewsAPI - Electronicpaymentsinternational.com,https://www.electronicpaymentsinternational.com/news/mastercard-hyperpay-to/,"Following this introduction, there are plans to expand these offerings to the United Arab Emirates (UAE) and Qatar.",positive,0.736284
2025-09-19,ITC to pass on full GST rate cut benefits to consumers across FMCG products,NewsAPI - BusinessLine,https://www.thehindubusinessline.com/companies/itc-to-pass-on-full-gst-rate-cut-benefits-to-consumers-across-fmcg-products/article70067107.ece,"ITC will pass on full GST rate cut benefits across FMCG products, lowering prices of brands like Aashirvaad, Bingo!, Sunfeast, YiPPee! and Mangaldeep.",positive,0.874884
2025-09-19,"Market Wrap: Sensex drops 387 pts, Nifty 50 slips below 25,400 as 3-day rally halts on profit-taking",NewsAPI - The Times of India,https://economictimes.indiatimes.com/markets/stocks/news/market-wrap-sensex-drops-387-pts-nifty-50-slips-below-25400-as-3-day-rally-halts-on-profit-taking/articleshow/123996369.cms,"Indian equities retreated on Friday, with the Sensex and Nifty snapping a three-day winning streak that had been buoyed by hopes of U.S. Federal Reserve rate cuts and progress in trade talks between New Delhi and Washington.",negative,0.97167
2025-09-19,"Trump to impose $100,000 fee per year for H-1B visas, in blow to tech",NewsAPI - Yahoo Entertainment,https://finance.yahoo.com/news/trump-impose-100-000-fee-182155462.html,"SAN FRANCISCO/WASHINGTON (Reuters) -The Trump administration said on Friday it would ask companies to pay $100,000 per year for H-1B worker visas, prompting ...",positive,0.541371
2025-09-19,GK Energy IPO subscribed 2.57 times on Day 1,NewsAPI - BusinessLine,https://www.thehindubusinessline.com/markets/gk-energy-ipo-subscribed-257-times-on-day-1/article70069842.ece,GK Energy Ltd's IPO for solar-powered agricultural water pump systems oversubscribed 2.57 times on first day of bidding.,negative,0.853377
2025-09-19,Salmonella and home delivery meals: How to protect yourself after the Metabolic Meals RECALL,NewsAPI - Naturalnews.com,https://www.naturalnews.com/2025-09-19-protect-yourself-from-salmonella-home-delivery-meals.html,"The CDC has linked several Metabolic home delivery dishes to a salmonella outbreak that has sickened people in at least 10 states and customers are being urged to check their freezers for recalled products. Foods like chicken teriyaki, steak with peanut sauce…",negative,0.537701
2025-09-19,"BOJ keeps interest rates steady, decides to start selling ETFs",NewsAPI - The Times of India,https://economictimes.indiatimes.com/markets/stocks/news/boj-keeps-interest-rates-steady-decides-to-start-selling-etfs/articleshow/123989415.cms,"The Bank of Japan (BOJ) has decided to maintain its short-term interest rates at 0.5% following a two-day policy meeting. However, in a significant shift, the BOJ will begin selling its holdings of exchange-traded funds (ETFs) and real-estate investment trust…",neutral,0.852537
2025-09-19,"iPhone 17 series sales start in India: Check price, offers on Redington, Croma, Reliance Digital, bank deals and more here",NewsAPI - The Times of India,https://economictimes.indiatimes.com/industry/cons-products/electronics/iphone-17-series-sales-start-in-india-check-price-offers-on-redington-croma-reliance-digital-bank-deals-and-more-here/articleshow/123991774.cms,"The iPhone 17 series and iPhone Air are now available in India. The lineup includes iPhone 17, Pro, Pro Max, and the Air. All models boast upgraded cameras and increased storage. The iPhone 17 runs on the A19 chip. The Pro and Air models use the A19 Pro. Laun…",neutral,0.877079
2025-09-19,Markets open lower despite Fed rate cut optimism,NewsAPI - BusinessLine,https://www.thehindubusinessline.com/markets/markets-open-lower-despite-fed-rate-cut-optimism/article70068706.ece,"Among the top gainers on the Nifty 50, Adani Enterprises led with a surge of 3.58 per cent to ₹2,487.90, followed by Adani Ports which gained 1.60 per cent to ₹1,435.40",positive,0.61319
2025-09-19,"Buzzing Stocks: Redington, GMDC, Netweb Technologies - Check Share Price, Stock Predictions And More",NewsAPI - Ndtvprofit.com,https://www.ndtvprofit.com/markets/buzzing-stocks-redington-gmdc-netweb-technologies-and-more,"Redington share price, Gujarat Mineral Development Corporation (GMDC), Netweb Technologies were the stocks buzzing in trade today. Indian equity benchmarks declined on Friday after a three-day rally. The BSE Sensex fell as much as 0.5% to 82,580, while the NS…",negative,0.972887
2025-09-19,"Adani Group Stocks Rise After SEBI's Clean Chit - Adani Power, Adani Total Gas Top Gainers",NewsAPI - Ndtvprofit.com,https://www.ndtvprofit.com/markets/adani-group-stocks-rise-after-sebis-clean-chit-adani-power-adani-total-gas-top-gainers,Shares of Adani Group companies rose during early trade on Friday after the Securities and Exchange Board of India said in its final order that allegations by the Hindenburg case could not be established. The flagship Adani Enterprises Ltd. soared 3.4% and Ad…,positive,0.945776
2025-09-19,GK Energy IPO subscribed 2.57 times on Day 1,NewsAPI - The Times of India,https://economictimes.indiatimes.com/markets/ipos/fpos/gk-energy-ipo-subscribed-2-57-times-on-day-1/articleshow/123999436.cms,"The initial public offering (IPO) of GK Energy Ltd, solar-powered agricultural water pump systems provider, got subscribed 2.57 times on the first day of bidding on Friday.",neutral,0.858126
2025-09-19,"Trump to impose $100,000 fee per year for H-1B visas, in likely blow to tech",NewsAPI - Yahoo Entertainment,https://ca.finance.yahoo.com/news/trump-mulls-adding-100-000-182155493.html,"SAN FRANCISCO/WASHINGTON (Reuters) -The Trump administration said on Friday it would ask companies to pay $100,000 per year for H-1B worker visas...",positive,0.616067
2025-09-19,"Inside the Fed’s economic projections, ‘something isn’t adding up’ according to SoFi investment chief",NewsAPI - Fortune,https://fortune.com/2025/09/19/the-feds-projections-something-isnt-adding-up-sofi-stocks/,The Fed says the economy will grow and unemployment will decline. So why did it cut interest rates on Wednesday?,negative,0.823325
2025-09-19,All You Need To Know Going Into Trade On Friday,NewsAPI - Ndtvprofit.com,https://www.ndtvprofit.com/markets/stock-market-today-all-you-need-to-know-going-into-trade-on-september-19-2025,"The NSE Nifty 50 ended 0.37% higher at 25,423.6 and the BSE Sensex closed 0.39% up at 83,013.96 on Thursday. Nifty September Futures up by 0.34% to 25,510 at a premium of 87 points. Nifty September futures open interest down by 1.12%. Nifty Options 23 Septemb…",negative,0.936589
2025-09-19,What sets great brokers apart from good ones? These 16 Angel One features offer clues,NewsAPI - The Times of India,https://economictimes.indiatimes.com/markets/options/what-sets-great-brokers-apart-from-good-ones-these-16-angel-one-features-offer-clues/articleshow/123992460.cms,"Brokerage platforms are increasingly integrating analytics-driven tools to enhance trading and investment experiences. Angel One leads with a comprehensive suite of features, including instant order placement from charts, index trading, and advanced portfolio…",neutral,0.857812
2025-09-19,Ixigo shares jump over 3% after Jefferies' Chris Wood adds stock in India long only portfolio,NewsAPI - The Times of India,https://economictimes.indiatimes.com/markets/stocks/news/ixigo-shares-jump-over-3-after-jefferies-chris-wood-adds-stock-in-india-long-only-portfolio/articleshow/123994944.cms,Ixigo shares gained over 3% after Chris Wood of Jefferies added the stock to the India long-only portfolio with a 4% weight. The stock's entry in Wood's portfolio comes on the back of a stellar run over the past year. The online travel company has rallied 88%…,positive,0.947204
2025-09-19,"Netweb's Monthly Order Wins Cross Rs 2,000 Crore With Fresh Pact To Supply AI GPU Systems",NewsAPI - Ndtvprofit.com,https://www.ndtvprofit.com/business/netwebs-monthly-order-wins-cross-rs-2000-crore-with-fresh-pact-to-supply-ai-gpu-systems,"Netweb Technologies India on Friday informed the bourses of an order win worth Rs 450 crore for the supply of Tyrone AI GPU accelerated systems, through an exchange filing. The company bagged the order from one of the largest Indian-headquartered global provi…",positive,0.910022
2025-09-19,Midcap stocks fund managers kept buying for six months,NewsAPI - BusinessLine,https://www.thehindubusinessline.com/portfolio/midcap-stocks-fund-managers-kept-buying-for-six-months/article70065972.ece,"Indian equity market rebounds, active fund managers add midcap stocks like Swiggy, One97 Communications, and IDFC First Bank.",negative,0.551795
2025-09-19,"Rupee ends choppy week on a quiet note, slight downward bias may persist",NewsAPI - The Times of India,https://economictimes.indiatimes.com/markets/forex/rupee-ends-choppy-week-on-a-quiet-note-slight-downward-bias-may-persist/articleshow/123996556.cms,"The Indian Rupee saw a volatile week, closing nearly unchanged on Friday. It initially rose to a two-week high before retreating. This happened as the dollar and U.S. bond yields increased despite a U.S. rate cut. The rupee is expected to trade between 87.50 …",negative,0.810492
2025-09-19,Urban Co readies for a dash as q-commerce run presses on,NewsAPI - The Times of India,https://economictimes.indiatimes.com/industry/services/retail/urban-company-with-insta-help-readies-for-a-dash-as-quick-commerce-run-presses-on-with-instant-services-afer-stellar-ipo-and-market-debut/articleshow/123993837.cms,"India's retail landscape is witnessing a quick commerce boom, with companies like Urban Company venturing into instant service delivery. Driven by evolving consumer expectations for immediate gratification, FMCG giants are also adapting with hyperlocal produc…",positive,0.66451
2025-09-19,"ITC chief for business models which focus on people, planet",NewsAPI - The Times of India,https://economictimes.indiatimes.com/industry/cons-products/fmcg/itc-chief-for-business-models-which-focus-on-people-planet/articleshow/123997299.cms,"ITC Ltd chairman Sanjiv Puri emphasised the necessity of prioritizing people and the planet in business models, highlighting the social responsibility of enterprises. He urged businesses to focus on innovation, sustainability, resilience, and skilling to navi…",neutral,0.85187
